Site,Parameter,Date (LST),Year,Month,Day,Hour,Value,Unit,Duration,QC Name
Shenyang,PM2.5,1/1/2017 0:00,2017,1,1,0,120,g/m,1 Hr,Valid
Shenyang,PM2.5,1/1/2017 1:00,2017,1,1,1,121,g/m,1 Hr,Valid
Shenyang,PM2.5,1/1/2017 2:00,2017,1,1,2,127,g/m,1 Hr,Valid
Shenyang,PM2.5,1/1/2017 3:00,2017,1,1,3,128,g/m,1 Hr,Valid
Shenyang,PM2.5,1/1/2017 4:00,2017,1,1,4,135,g/m,1 Hr,Valid
Shenyang,PM2.5,1/1/2017 5:00,2017,1,1,5,133,g/m,1 Hr,Valid
Shenyang,PM2.5,1/1/2017 6:00,2017,1,1,6,141,g/m,1 Hr,Valid
Shenyang,PM2.5,1/1/2017 7:00,2017,1,1,7,143,g/m,1 Hr,Valid
Shenyang,PM2.5,1/1/2017 8:00,2017,1,1,8,158,g/m,1 Hr,Valid
Shenyang,PM2.5,1/1/2017 9:00,2017,1,1,9,162,g/m,1 Hr,Valid
Shenyang,PM2.5,1/1/2017 10:00,2017,1,1,10,176,g/m,1 Hr,Valid
Shenyang,PM2.5,1/1/2017 11:00,2017,1,1,11,184,g/m,1 Hr,Valid
Shenyang,PM2.5,1/1/2017 12:00,2017,1,1,12,199,g/m,1 Hr,Valid
Shenyang,PM2.5,1/1/2017 13:00,2017,1,1,13,202,g/m,1 Hr,Valid
Shenyang,PM2.5,1/1/2017 14:00,2017,1,1,14,221,g/m,1 Hr,Valid
Shenyang,PM2.5,1/1/2017 15:00,2017,1,1,15,223,g/m,1 Hr,Valid
Shenyang,PM2.5,1/1/2017 16:00,2017,1,1,16,238,g/m,1 Hr,Valid
Shenyang,PM2.5,1/1/2017 17:00,2017,1,1,17,235,g/m,1 Hr,Valid
Shenyang,PM2.5,1/1/2017 18:00,2017,1,1,18,253,g/m,1 Hr,Valid
Shenyang,PM2.5,1/1/2017 19:00,2017,1,1,19,255,g/m,1 Hr,Valid
Shenyang,PM2.5,1/1/2017 20:00,2017,1,1,20,258,g/m,1 Hr,Valid
Shenyang,PM2.5,1/1/2017 21:00,2017,1,1,21,267,g/m,1 Hr,Valid
Shenyang,PM2.5,1/1/2017 22:00,2017,1,1,22,263,g/m,1 Hr,Valid
Shenyang,PM2.5,1/1/2017 23:00,2017,1,1,23,273,g/m,1 Hr,Valid
Shenyang,PM2.5,1/2/2017 0:00,2017,1,2,0,265,g/m,1 Hr,Valid
Shenyang,PM2.5,1/2/2017 1:00,2017,1,2,1,250,g/m,1 Hr,Valid
Shenyang,PM2.5,1/2/2017 2:00,2017,1,2,2,247,g/m,1 Hr,Valid
Shenyang,PM2.5,1/2/2017 3:00,2017,1,2,3,233,g/m,1 Hr,Valid
Shenyang,PM2.5,1/2/2017 4:00,2017,1,2,4,220,g/m,1 Hr,Valid
Shenyang,PM2.5,1/2/2017 5:00,2017,1,2,5,194,g/m,1 Hr,Valid
Shenyang,PM2.5,1/2/2017 6:00,2017,1,2,6,154,g/m,1 Hr,Valid
Shenyang,PM2.5,1/2/2017 7:00,2017,1,2,7,130,g/m,1 Hr,Valid
Shenyang,PM2.5,1/2/2017 8:00,2017,1,2,8,124,g/m,1 Hr,Valid
Shenyang,PM2.5,1/2/2017 9:00,2017,1,2,9,109,g/m,1 Hr,Valid
Shenyang,PM2.5,1/2/2017 10:00,2017,1,2,10,115,g/m,1 Hr,Valid
Shenyang,PM2.5,1/2/2017 11:00,2017,1,2,11,44,g/m,1 Hr,Valid
Shenyang,PM2.5,1/2/2017 12:00,2017,1,2,12,44,g/m,1 Hr,Valid
Shenyang,PM2.5,1/2/2017 13:00,2017,1,2,13,17,g/m,1 Hr,Valid
Shenyang,PM2.5,1/2/2017 14:00,2017,1,2,14,17,g/m,1 Hr,Valid
Shenyang,PM2.5,1/2/2017 15:00,2017,1,2,15,21,g/m,1 Hr,Valid
Shenyang,PM2.5,1/2/2017 16:00,2017,1,2,16,26,g/m,1 Hr,Valid
Shenyang,PM2.5,1/2/2017 17:00,2017,1,2,17,31,g/m,1 Hr,Valid
Shenyang,PM2.5,1/2/2017 18:00,2017,1,2,18,32,g/m,1 Hr,Valid
Shenyang,PM2.5,1/2/2017 19:00,2017,1,2,19,47,g/m,1 Hr,Valid
Shenyang,PM2.5,1/2/2017 20:00,2017,1,2,20,58,g/m,1 Hr,Valid
Shenyang,PM2.5,1/2/2017 21:00,2017,1,2,21,64,g/m,1 Hr,Valid
Shenyang,PM2.5,1/2/2017 22:00,2017,1,2,22,53,g/m,1 Hr,Valid
Shenyang,PM2.5,1/2/2017 23:00,2017,1,2,23,55,g/m,1 Hr,Valid
Shenyang,PM2.5,1/3/2017 0:00,2017,1,3,0,38,g/m,1 Hr,Valid
Shenyang,PM2.5,1/3/2017 1:00,2017,1,3,1,42,g/m,1 Hr,Valid
Shenyang,PM2.5,1/3/2017 2:00,2017,1,3,2,52,g/m,1 Hr,Valid
Shenyang,PM2.5,1/3/2017 3:00,2017,1,3,3,78,g/m,1 Hr,Valid
Shenyang,PM2.5,1/3/2017 4:00,2017,1,3,4,90,g/m,1 Hr,Valid
Shenyang,PM2.5,1/3/2017 5:00,2017,1,3,5,106,g/m,1 Hr,Valid
Shenyang,PM2.5,1/3/2017 6:00,2017,1,3,6,98,g/m,1 Hr,Valid
Shenyang,PM2.5,1/3/2017 7:00,2017,1,3,7,117,g/m,1 Hr,Valid
Shenyang,PM2.5,1/3/2017 8:00,2017,1,3,8,107,g/m,1 Hr,Valid
Shenyang,PM2.5,1/3/2017 9:00,2017,1,3,9,124,g/m,1 Hr,Valid
Shenyang,PM2.5,1/3/2017 10:00,2017,1,3,10,96,g/m,1 Hr,Valid
Shenyang,PM2.5,1/3/2017 11:00,2017,1,3,11,112,g/m,1 Hr,Valid
Shenyang,PM2.5,1/3/2017 12:00,2017,1,3,12,129,g/m,1 Hr,Valid
Shenyang,PM2.5,1/3/2017 13:00,2017,1,3,13,132,g/m,1 Hr,Valid
Shenyang,PM2.5,1/3/2017 14:00,2017,1,3,14,126,g/m,1 Hr,Valid
Shenyang,PM2.5,1/3/2017 15:00,2017,1,3,15,136,g/m,1 Hr,Valid
Shenyang,PM2.5,1/3/2017 16:00,2017,1,3,16,147,g/m,1 Hr,Valid
Shenyang,PM2.5,1/3/2017 17:00,2017,1,3,17,166,g/m,1 Hr,Valid
Shenyang,PM2.5,1/3/2017 18:00,2017,1,3,18,180,g/m,1 Hr,Valid
Shenyang,PM2.5,1/3/2017 19:00,2017,1,3,19,194,g/m,1 Hr,Valid
Shenyang,PM2.5,1/3/2017 20:00,2017,1,3,20,207,g/m,1 Hr,Valid
Shenyang,PM2.5,1/3/2017 21:00,2017,1,3,21,218,g/m,1 Hr,Valid
Shenyang,PM2.5,1/3/2017 22:00,2017,1,3,22,226,g/m,1 Hr,Valid
Shenyang,PM2.5,1/3/2017 23:00,2017,1,3,23,253,g/m,1 Hr,Valid
Shenyang,PM2.5,1/4/2017 0:00,2017,1,4,0,239,g/m,1 Hr,Valid
Shenyang,PM2.5,1/4/2017 1:00,2017,1,4,1,243,g/m,1 Hr,Valid
Shenyang,PM2.5,1/4/2017 2:00,2017,1,4,2,271,g/m,1 Hr,Valid
Shenyang,PM2.5,1/4/2017 3:00,2017,1,4,3,235,g/m,1 Hr,Valid
Shenyang,PM2.5,1/4/2017 4:00,2017,1,4,4,204,g/m,1 Hr,Valid
Shenyang,PM2.5,1/4/2017 5:00,2017,1,4,5,174,g/m,1 Hr,Valid
Shenyang,PM2.5,1/4/2017 6:00,2017,1,4,6,187,g/m,1 Hr,Valid
Shenyang,PM2.5,1/4/2017 7:00,2017,1,4,7,185,g/m,1 Hr,Valid
Shenyang,PM2.5,1/4/2017 8:00,2017,1,4,8,229,g/m,1 Hr,Valid
Shenyang,PM2.5,1/4/2017 9:00,2017,1,4,9,198,g/m,1 Hr,Valid
Shenyang,PM2.5,1/4/2017 10:00,2017,1,4,10,225,g/m,1 Hr,Valid
Shenyang,PM2.5,1/4/2017 11:00,2017,1,4,11,274,g/m,1 Hr,Valid
Shenyang,PM2.5,1/4/2017 12:00,2017,1,4,12,217,g/m,1 Hr,Valid
Shenyang,PM2.5,1/4/2017 13:00,2017,1,4,13,165,g/m,1 Hr,Valid
Shenyang,PM2.5,1/4/2017 14:00,2017,1,4,14,144,g/m,1 Hr,Valid
Shenyang,PM2.5,1/4/2017 15:00,2017,1,4,15,49,g/m,1 Hr,Valid
Shenyang,PM2.5,1/4/2017 16:00,2017,1,4,16,23,g/m,1 Hr,Valid
Shenyang,PM2.5,1/4/2017 17:00,2017,1,4,17,35,g/m,1 Hr,Valid
Shenyang,PM2.5,1/4/2017 18:00,2017,1,4,18,52,g/m,1 Hr,Valid
Shenyang,PM2.5,1/4/2017 19:00,2017,1,4,19,52,g/m,1 Hr,Valid
Shenyang,PM2.5,1/4/2017 20:00,2017,1,4,20,84,g/m,1 Hr,Valid
Shenyang,PM2.5,1/4/2017 21:00,2017,1,4,21,52,g/m,1 Hr,Valid
Shenyang,PM2.5,1/4/2017 22:00,2017,1,4,22,41,g/m,1 Hr,Valid
Shenyang,PM2.5,1/4/2017 23:00,2017,1,4,23,56,g/m,1 Hr,Valid
Shenyang,PM2.5,1/5/2017 0:00,2017,1,5,0,64,g/m,1 Hr,Valid
Shenyang,PM2.5,1/5/2017 1:00,2017,1,5,1,67,g/m,1 Hr,Valid
Shenyang,PM2.5,1/5/2017 2:00,2017,1,5,2,63,g/m,1 Hr,Valid
Shenyang,PM2.5,1/5/2017 3:00,2017,1,5,3,85,g/m,1 Hr,Valid
Shenyang,PM2.5,1/5/2017 4:00,2017,1,5,4,76,g/m,1 Hr,Valid
Shenyang,PM2.5,1/5/2017 5:00,2017,1,5,5,69,g/m,1 Hr,Valid
Shenyang,PM2.5,1/5/2017 6:00,2017,1,5,6,53,g/m,1 Hr,Valid
Shenyang,PM2.5,1/5/2017 7:00,2017,1,5,7,51,g/m,1 Hr,Valid
Shenyang,PM2.5,1/5/2017 8:00,2017,1,5,8,66,g/m,1 Hr,Valid
Shenyang,PM2.5,1/5/2017 9:00,2017,1,5,9,76,g/m,1 Hr,Valid
Shenyang,PM2.5,1/5/2017 10:00,2017,1,5,10,72,g/m,1 Hr,Valid
Shenyang,PM2.5,1/5/2017 11:00,2017,1,5,11,69,g/m,1 Hr,Valid
Shenyang,PM2.5,1/5/2017 12:00,2017,1,5,12,80,g/m,1 Hr,Valid
Shenyang,PM2.5,1/5/2017 13:00,2017,1,5,13,99,g/m,1 Hr,Valid
Shenyang,PM2.5,1/5/2017 14:00,2017,1,5,14,72,g/m,1 Hr,Valid
Shenyang,PM2.5,1/5/2017 15:00,2017,1,5,15,73,g/m,1 Hr,Valid
Shenyang,PM2.5,1/5/2017 16:00,2017,1,5,16,62,g/m,1 Hr,Valid
Shenyang,PM2.5,1/5/2017 17:00,2017,1,5,17,59,g/m,1 Hr,Valid
Shenyang,PM2.5,1/5/2017 18:00,2017,1,5,18,71,g/m,1 Hr,Valid
Shenyang,PM2.5,1/5/2017 19:00,2017,1,5,19,92,g/m,1 Hr,Valid
Shenyang,PM2.5,1/5/2017 20:00,2017,1,5,20,108,g/m,1 Hr,Valid
Shenyang,PM2.5,1/5/2017 21:00,2017,1,5,21,135,g/m,1 Hr,Valid
Shenyang,PM2.5,1/5/2017 22:00,2017,1,5,22,100,g/m,1 Hr,Valid
Shenyang,PM2.5,1/5/2017 23:00,2017,1,5,23,130,g/m,1 Hr,Valid
Shenyang,PM2.5,1/6/2017 0:00,2017,1,6,0,145,g/m,1 Hr,Valid
Shenyang,PM2.5,1/6/2017 1:00,2017,1,6,1,163,g/m,1 Hr,Valid
Shenyang,PM2.5,1/6/2017 2:00,2017,1,6,2,129,g/m,1 Hr,Valid
Shenyang,PM2.5,1/6/2017 3:00,2017,1,6,3,138,g/m,1 Hr,Valid
Shenyang,PM2.5,1/6/2017 4:00,2017,1,6,4,125,g/m,1 Hr,Valid
Shenyang,PM2.5,1/6/2017 5:00,2017,1,6,5,130,g/m,1 Hr,Valid
Shenyang,PM2.5,1/6/2017 6:00,2017,1,6,6,129,g/m,1 Hr,Valid
Shenyang,PM2.5,1/6/2017 7:00,2017,1,6,7,171,g/m,1 Hr,Valid
Shenyang,PM2.5,1/6/2017 8:00,2017,1,6,8,148,g/m,1 Hr,Valid
Shenyang,PM2.5,1/6/2017 9:00,2017,1,6,9,153,g/m,1 Hr,Valid
Shenyang,PM2.5,1/6/2017 10:00,2017,1,6,10,160,g/m,1 Hr,Valid
Shenyang,PM2.5,1/6/2017 11:00,2017,1,6,11,175,g/m,1 Hr,Valid
Shenyang,PM2.5,1/6/2017 12:00,2017,1,6,12,127,g/m,1 Hr,Valid
Shenyang,PM2.5,1/6/2017 13:00,2017,1,6,13,100,g/m,1 Hr,Valid
Shenyang,PM2.5,1/6/2017 14:00,2017,1,6,14,75,g/m,1 Hr,Valid
Shenyang,PM2.5,1/6/2017 15:00,2017,1,6,15,91,g/m,1 Hr,Valid
Shenyang,PM2.5,1/6/2017 16:00,2017,1,6,16,97,g/m,1 Hr,Valid
Shenyang,PM2.5,1/6/2017 17:00,2017,1,6,17,124,g/m,1 Hr,Valid
Shenyang,PM2.5,1/6/2017 18:00,2017,1,6,18,137,g/m,1 Hr,Valid
Shenyang,PM2.5,1/6/2017 19:00,2017,1,6,19,97,g/m,1 Hr,Valid
Shenyang,PM2.5,1/6/2017 20:00,2017,1,6,20,69,g/m,1 Hr,Valid
Shenyang,PM2.5,1/6/2017 21:00,2017,1,6,21,82,g/m,1 Hr,Valid
Shenyang,PM2.5,1/6/2017 22:00,2017,1,6,22,93,g/m,1 Hr,Valid
Shenyang,PM2.5,1/6/2017 23:00,2017,1,6,23,106,g/m,1 Hr,Valid
Shenyang,PM2.5,1/7/2017 0:00,2017,1,7,0,134,g/m,1 Hr,Valid
Shenyang,PM2.5,1/7/2017 1:00,2017,1,7,1,134,g/m,1 Hr,Valid
Shenyang,PM2.5,1/7/2017 2:00,2017,1,7,2,179,g/m,1 Hr,Valid
Shenyang,PM2.5,1/7/2017 3:00,2017,1,7,3,200,g/m,1 Hr,Valid
Shenyang,PM2.5,1/7/2017 4:00,2017,1,7,4,196,g/m,1 Hr,Valid
Shenyang,PM2.5,1/7/2017 5:00,2017,1,7,5,190,g/m,1 Hr,Valid
Shenyang,PM2.5,1/7/2017 6:00,2017,1,7,6,207,g/m,1 Hr,Valid
Shenyang,PM2.5,1/7/2017 7:00,2017,1,7,7,222,g/m,1 Hr,Valid
Shenyang,PM2.5,1/7/2017 8:00,2017,1,7,8,168,g/m,1 Hr,Valid
Shenyang,PM2.5,1/7/2017 9:00,2017,1,7,9,123,g/m,1 Hr,Valid
Shenyang,PM2.5,1/7/2017 10:00,2017,1,7,10,141,g/m,1 Hr,Valid
Shenyang,PM2.5,1/7/2017 11:00,2017,1,7,11,237,g/m,1 Hr,Valid
Shenyang,PM2.5,1/7/2017 12:00,2017,1,7,12,177,g/m,1 Hr,Valid
Shenyang,PM2.5,1/7/2017 13:00,2017,1,7,13,205,g/m,1 Hr,Valid
Shenyang,PM2.5,1/7/2017 14:00,2017,1,7,14,239,g/m,1 Hr,Valid
Shenyang,PM2.5,1/7/2017 15:00,2017,1,7,15,214,g/m,1 Hr,Valid
Shenyang,PM2.5,1/7/2017 16:00,2017,1,7,16,209,g/m,1 Hr,Valid
Shenyang,PM2.5,1/7/2017 17:00,2017,1,7,17,223,g/m,1 Hr,Valid
Shenyang,PM2.5,1/7/2017 18:00,2017,1,7,18,231,g/m,1 Hr,Valid
Shenyang,PM2.5,1/7/2017 19:00,2017,1,7,19,216,g/m,1 Hr,Valid
Shenyang,PM2.5,1/7/2017 20:00,2017,1,7,20,217,g/m,1 Hr,Valid
Shenyang,PM2.5,1/7/2017 21:00,2017,1,7,21,219,g/m,1 Hr,Valid
Shenyang,PM2.5,1/7/2017 22:00,2017,1,7,22,224,g/m,1 Hr,Valid
Shenyang,PM2.5,1/7/2017 23:00,2017,1,7,23,233,g/m,1 Hr,Valid
Shenyang,PM2.5,1/8/2017 0:00,2017,1,8,0,236,g/m,1 Hr,Valid
Shenyang,PM2.5,1/8/2017 1:00,2017,1,8,1,232,g/m,1 Hr,Valid
Shenyang,PM2.5,1/8/2017 2:00,2017,1,8,2,238,g/m,1 Hr,Valid
Shenyang,PM2.5,1/8/2017 3:00,2017,1,8,3,254,g/m,1 Hr,Valid
Shenyang,PM2.5,1/8/2017 4:00,2017,1,8,4,239,g/m,1 Hr,Valid
Shenyang,PM2.5,1/8/2017 5:00,2017,1,8,5,240,g/m,1 Hr,Valid
Shenyang,PM2.5,1/8/2017 6:00,2017,1,8,6,206,g/m,1 Hr,Valid
Shenyang,PM2.5,1/8/2017 7:00,2017,1,8,7,208,g/m,1 Hr,Valid
Shenyang,PM2.5,1/8/2017 8:00,2017,1,8,8,215,g/m,1 Hr,Valid
Shenyang,PM2.5,1/8/2017 9:00,2017,1,8,9,210,g/m,1 Hr,Valid
Shenyang,PM2.5,1/8/2017 10:00,2017,1,8,10,211,g/m,1 Hr,Valid
Shenyang,PM2.5,1/8/2017 11:00,2017,1,8,11,236,g/m,1 Hr,Valid
Shenyang,PM2.5,1/8/2017 12:00,2017,1,8,12,229,g/m,1 Hr,Valid
Shenyang,PM2.5,1/8/2017 13:00,2017,1,8,13,250,g/m,1 Hr,Valid
Shenyang,PM2.5,1/8/2017 14:00,2017,1,8,14,241,g/m,1 Hr,Valid
Shenyang,PM2.5,1/8/2017 15:00,2017,1,8,15,205,g/m,1 Hr,Valid
Shenyang,PM2.5,1/8/2017 16:00,2017,1,8,16,205,g/m,1 Hr,Valid
Shenyang,PM2.5,1/8/2017 17:00,2017,1,8,17,198,g/m,1 Hr,Valid
Shenyang,PM2.5,1/8/2017 18:00,2017,1,8,18,210,g/m,1 Hr,Valid
Shenyang,PM2.5,1/8/2017 19:00,2017,1,8,19,234,g/m,1 Hr,Valid
Shenyang,PM2.5,1/8/2017 20:00,2017,1,8,20,272,g/m,1 Hr,Valid
Shenyang,PM2.5,1/8/2017 21:00,2017,1,8,21,233,g/m,1 Hr,Valid
Shenyang,PM2.5,1/8/2017 22:00,2017,1,8,22,205,g/m,1 Hr,Valid
Shenyang,PM2.5,1/8/2017 23:00,2017,1,8,23,199,g/m,1 Hr,Valid
Shenyang,PM2.5,1/9/2017 0:00,2017,1,9,0,176,g/m,1 Hr,Valid
Shenyang,PM2.5,1/9/2017 1:00,2017,1,9,1,118,g/m,1 Hr,Valid
Shenyang,PM2.5,1/9/2017 2:00,2017,1,9,2,46,g/m,1 Hr,Valid
Shenyang,PM2.5,1/9/2017 3:00,2017,1,9,3,28,g/m,1 Hr,Valid
Shenyang,PM2.5,1/9/2017 4:00,2017,1,9,4,15,g/m,1 Hr,Valid
Shenyang,PM2.5,1/9/2017 5:00,2017,1,9,5,14,g/m,1 Hr,Valid
Shenyang,PM2.5,1/9/2017 6:00,2017,1,9,6,20,g/m,1 Hr,Valid
Shenyang,PM2.5,1/9/2017 7:00,2017,1,9,7,14,g/m,1 Hr,Valid
Shenyang,PM2.5,1/9/2017 8:00,2017,1,9,8,15,g/m,1 Hr,Valid
Shenyang,PM2.5,1/9/2017 9:00,2017,1,9,9,16,g/m,1 Hr,Valid
Shenyang,PM2.5,1/9/2017 10:00,2017,1,9,10,17,g/m,1 Hr,Valid
Shenyang,PM2.5,1/9/2017 11:00,2017,1,9,11,15,g/m,1 Hr,Valid
Shenyang,PM2.5,1/9/2017 12:00,2017,1,9,12,15,g/m,1 Hr,Valid
Shenyang,PM2.5,1/9/2017 13:00,2017,1,9,13,17,g/m,1 Hr,Valid
Shenyang,PM2.5,1/9/2017 14:00,2017,1,9,14,25,g/m,1 Hr,Valid
Shenyang,PM2.5,1/9/2017 15:00,2017,1,9,15,12,g/m,1 Hr,Valid
Shenyang,PM2.5,1/9/2017 16:00,2017,1,9,16,28,g/m,1 Hr,Valid
Shenyang,PM2.5,1/9/2017 17:00,2017,1,9,17,22,g/m,1 Hr,Valid
Shenyang,PM2.5,1/9/2017 18:00,2017,1,9,18,34,g/m,1 Hr,Valid
Shenyang,PM2.5,1/9/2017 19:00,2017,1,9,19,34,g/m,1 Hr,Valid
Shenyang,PM2.5,1/9/2017 20:00,2017,1,9,20,31,g/m,1 Hr,Valid
Shenyang,PM2.5,1/9/2017 21:00,2017,1,9,21,42,g/m,1 Hr,Valid
Shenyang,PM2.5,1/9/2017 22:00,2017,1,9,22,50,g/m,1 Hr,Valid
Shenyang,PM2.5,1/9/2017 23:00,2017,1,9,23,47,g/m,1 Hr,Valid
Shenyang,PM2.5,1/10/2017 0:00,2017,1,10,0,68,g/m,1 Hr,Valid
Shenyang,PM2.5,1/10/2017 1:00,2017,1,10,1,70,g/m,1 Hr,Valid
Shenyang,PM2.5,1/10/2017 2:00,2017,1,10,2,43,g/m,1 Hr,Valid
Shenyang,PM2.5,1/10/2017 3:00,2017,1,10,3,19,g/m,1 Hr,Valid
Shenyang,PM2.5,1/10/2017 4:00,2017,1,10,4,11,g/m,1 Hr,Valid
Shenyang,PM2.5,1/10/2017 5:00,2017,1,10,5,11,g/m,1 Hr,Valid
Shenyang,PM2.5,1/10/2017 6:00,2017,1,10,6,13,g/m,1 Hr,Valid
Shenyang,PM2.5,1/10/2017 7:00,2017,1,10,7,12,g/m,1 Hr,Valid
Shenyang,PM2.5,1/10/2017 8:00,2017,1,10,8,16,g/m,1 Hr,Valid
Shenyang,PM2.5,1/10/2017 9:00,2017,1,10,9,23,g/m,1 Hr,Valid
Shenyang,PM2.5,1/10/2017 10:00,2017,1,10,10,14,g/m,1 Hr,Valid
Shenyang,PM2.5,1/10/2017 11:00,2017,1,10,11,17,g/m,1 Hr,Valid
Shenyang,PM2.5,1/10/2017 12:00,2017,1,10,12,12,g/m,1 Hr,Valid
Shenyang,PM2.5,1/10/2017 13:00,2017,1,10,13,16,g/m,1 Hr,Valid
Shenyang,PM2.5,1/10/2017 14:00,2017,1,10,14,3,g/m,1 Hr,Valid
Shenyang,PM2.5,1/10/2017 15:00,2017,1,10,15,22,g/m,1 Hr,Valid
Shenyang,PM2.5,1/10/2017 16:00,2017,1,10,16,19,g/m,1 Hr,Valid
Shenyang,PM2.5,1/10/2017 17:00,2017,1,10,17,28,g/m,1 Hr,Valid
Shenyang,PM2.5,1/10/2017 18:00,2017,1,10,18,28,g/m,1 Hr,Valid
Shenyang,PM2.5,1/10/2017 19:00,2017,1,10,19,42,g/m,1 Hr,Valid
Shenyang,PM2.5,1/10/2017 20:00,2017,1,10,20,53,g/m,1 Hr,Valid
Shenyang,PM2.5,1/10/2017 21:00,2017,1,10,21,57,g/m,1 Hr,Valid
Shenyang,PM2.5,1/10/2017 22:00,2017,1,10,22,70,g/m,1 Hr,Valid
Shenyang,PM2.5,1/10/2017 23:00,2017,1,10,23,78,g/m,1 Hr,Valid
Shenyang,PM2.5,1/11/2017 0:00,2017,1,11,0,81,g/m,1 Hr,Valid
Shenyang,PM2.5,1/11/2017 1:00,2017,1,11,1,87,g/m,1 Hr,Valid
Shenyang,PM2.5,1/11/2017 2:00,2017,1,11,2,26,g/m,1 Hr,Valid
Shenyang,PM2.5,1/11/2017 3:00,2017,1,11,3,20,g/m,1 Hr,Valid
Shenyang,PM2.5,1/11/2017 4:00,2017,1,11,4,23,g/m,1 Hr,Valid
Shenyang,PM2.5,1/11/2017 5:00,2017,1,11,5,19,g/m,1 Hr,Valid
Shenyang,PM2.5,1/11/2017 6:00,2017,1,11,6,12,g/m,1 Hr,Valid
Shenyang,PM2.5,1/11/2017 7:00,2017,1,11,7,143,g/m,1 Hr,Valid
Shenyang,PM2.5,1/11/2017 8:00,2017,1,11,8,116,g/m,1 Hr,Valid
Shenyang,PM2.5,1/11/2017 9:00,2017,1,11,9,104,g/m,1 Hr,Valid
Shenyang,PM2.5,1/11/2017 10:00,2017,1,11,10,100,g/m,1 Hr,Valid
Shenyang,PM2.5,1/11/2017 11:00,2017,1,11,11,66,g/m,1 Hr,Valid
Shenyang,PM2.5,1/11/2017 12:00,2017,1,11,12,33,g/m,1 Hr,Valid
Shenyang,PM2.5,1/11/2017 13:00,2017,1,11,13,43,g/m,1 Hr,Valid
Shenyang,PM2.5,1/11/2017 14:00,2017,1,11,14,37,g/m,1 Hr,Valid
Shenyang,PM2.5,1/11/2017 15:00,2017,1,11,15,43,g/m,1 Hr,Valid
Shenyang,PM2.5,1/11/2017 16:00,2017,1,11,16,40,g/m,1 Hr,Valid
Shenyang,PM2.5,1/11/2017 17:00,2017,1,11,17,48,g/m,1 Hr,Valid
Shenyang,PM2.5,1/11/2017 18:00,2017,1,11,18,51,g/m,1 Hr,Valid
Shenyang,PM2.5,1/11/2017 19:00,2017,1,11,19,64,g/m,1 Hr,Valid
Shenyang,PM2.5,1/11/2017 20:00,2017,1,11,20,82,g/m,1 Hr,Valid
Shenyang,PM2.5,1/11/2017 21:00,2017,1,11,21,77,g/m,1 Hr,Valid
Shenyang,PM2.5,1/11/2017 22:00,2017,1,11,22,104,g/m,1 Hr,Valid
Shenyang,PM2.5,1/11/2017 23:00,2017,1,11,23,114,g/m,1 Hr,Valid
Shenyang,PM2.5,1/12/2017 0:00,2017,1,12,0,102,g/m,1 Hr,Valid
Shenyang,PM2.5,1/12/2017 1:00,2017,1,12,1,75,g/m,1 Hr,Valid
Shenyang,PM2.5,1/12/2017 2:00,2017,1,12,2,52,g/m,1 Hr,Valid
Shenyang,PM2.5,1/12/2017 3:00,2017,1,12,3,27,g/m,1 Hr,Valid
Shenyang,PM2.5,1/12/2017 4:00,2017,1,12,4,8,g/m,1 Hr,Valid
Shenyang,PM2.5,1/12/2017 5:00,2017,1,12,5,25,g/m,1 Hr,Valid
Shenyang,PM2.5,1/12/2017 6:00,2017,1,12,6,30,g/m,1 Hr,Valid
Shenyang,PM2.5,1/12/2017 7:00,2017,1,12,7,24,g/m,1 Hr,Valid
Shenyang,PM2.5,1/12/2017 8:00,2017,1,12,8,19,g/m,1 Hr,Valid
Shenyang,PM2.5,1/12/2017 9:00,2017,1,12,9,19,g/m,1 Hr,Valid
Shenyang,PM2.5,1/12/2017 10:00,2017,1,12,10,23,g/m,1 Hr,Valid
Shenyang,PM2.5,1/12/2017 11:00,2017,1,12,11,18,g/m,1 Hr,Valid
Shenyang,PM2.5,1/12/2017 12:00,2017,1,12,12,26,g/m,1 Hr,Valid
Shenyang,PM2.5,1/12/2017 13:00,2017,1,12,13,15,g/m,1 Hr,Valid
Shenyang,PM2.5,1/12/2017 14:00,2017,1,12,14,13,g/m,1 Hr,Valid
Shenyang,PM2.5,1/12/2017 15:00,2017,1,12,15,16,g/m,1 Hr,Valid
Shenyang,PM2.5,1/12/2017 16:00,2017,1,12,16,19,g/m,1 Hr,Valid
Shenyang,PM2.5,1/12/2017 17:00,2017,1,12,17,29,g/m,1 Hr,Valid
Shenyang,PM2.5,1/12/2017 18:00,2017,1,12,18,38,g/m,1 Hr,Valid
Shenyang,PM2.5,1/12/2017 19:00,2017,1,12,19,49,g/m,1 Hr,Valid
Shenyang,PM2.5,1/12/2017 20:00,2017,1,12,20,44,g/m,1 Hr,Valid
Shenyang,PM2.5,1/12/2017 21:00,2017,1,12,21,55,g/m,1 Hr,Valid
Shenyang,PM2.5,1/12/2017 22:00,2017,1,12,22,55,g/m,1 Hr,Valid
Shenyang,PM2.5,1/12/2017 23:00,2017,1,12,23,59,g/m,1 Hr,Valid
Shenyang,PM2.5,1/13/2017 0:00,2017,1,13,0,51,g/m,1 Hr,Valid
Shenyang,PM2.5,1/13/2017 1:00,2017,1,13,1,54,g/m,1 Hr,Valid
Shenyang,PM2.5,1/13/2017 2:00,2017,1,13,2,30,g/m,1 Hr,Valid
Shenyang,PM2.5,1/13/2017 3:00,2017,1,13,3,20,g/m,1 Hr,Valid
Shenyang,PM2.5,1/13/2017 4:00,2017,1,13,4,10,g/m,1 Hr,Valid
Shenyang,PM2.5,1/13/2017 5:00,2017,1,13,5,12,g/m,1 Hr,Valid
Shenyang,PM2.5,1/13/2017 6:00,2017,1,13,6,12,g/m,1 Hr,Valid
Shenyang,PM2.5,1/13/2017 7:00,2017,1,13,7,17,g/m,1 Hr,Valid
Shenyang,PM2.5,1/13/2017 8:00,2017,1,13,8,18,g/m,1 Hr,Valid
Shenyang,PM2.5,1/13/2017 9:00,2017,1,13,9,16,g/m,1 Hr,Valid
Shenyang,PM2.5,1/13/2017 10:00,2017,1,13,10,26,g/m,1 Hr,Valid
Shenyang,PM2.5,1/13/2017 11:00,2017,1,13,11,23,g/m,1 Hr,Valid
Shenyang,PM2.5,1/13/2017 12:00,2017,1,13,12,10,g/m,1 Hr,Valid
Shenyang,PM2.5,1/13/2017 13:00,2017,1,13,13,14,g/m,1 Hr,Valid
Shenyang,PM2.5,1/13/2017 14:00,2017,1,13,14,9,g/m,1 Hr,Valid
Shenyang,PM2.5,1/13/2017 15:00,2017,1,13,15,17,g/m,1 Hr,Valid
Shenyang,PM2.5,1/13/2017 16:00,2017,1,13,16,10,g/m,1 Hr,Valid
Shenyang,PM2.5,1/13/2017 17:00,2017,1,13,17,22,g/m,1 Hr,Valid
Shenyang,PM2.5,1/13/2017 18:00,2017,1,13,18,18,g/m,1 Hr,Valid
Shenyang,PM2.5,1/13/2017 19:00,2017,1,13,19,23,g/m,1 Hr,Valid
Shenyang,PM2.5,1/13/2017 20:00,2017,1,13,20,28,g/m,1 Hr,Valid
Shenyang,PM2.5,1/13/2017 21:00,2017,1,13,21,34,g/m,1 Hr,Valid
Shenyang,PM2.5,1/13/2017 22:00,2017,1,13,22,27,g/m,1 Hr,Valid
Shenyang,PM2.5,1/13/2017 23:00,2017,1,13,23,21,g/m,1 Hr,Valid
Shenyang,PM2.5,1/14/2017 0:00,2017,1,14,0,20,g/m,1 Hr,Valid
Shenyang,PM2.5,1/14/2017 1:00,2017,1,14,1,22,g/m,1 Hr,Valid
Shenyang,PM2.5,1/14/2017 2:00,2017,1,14,2,17,g/m,1 Hr,Valid
Shenyang,PM2.5,1/14/2017 3:00,2017,1,14,3,24,g/m,1 Hr,Valid
Shenyang,PM2.5,1/14/2017 4:00,2017,1,14,4,20,g/m,1 Hr,Valid
Shenyang,PM2.5,1/14/2017 5:00,2017,1,14,5,19,g/m,1 Hr,Valid
Shenyang,PM2.5,1/14/2017 6:00,2017,1,14,6,18,g/m,1 Hr,Valid
Shenyang,PM2.5,1/14/2017 7:00,2017,1,14,7,35,g/m,1 Hr,Valid
Shenyang,PM2.5,1/14/2017 8:00,2017,1,14,8,31,g/m,1 Hr,Valid
Shenyang,PM2.5,1/14/2017 9:00,2017,1,14,9,32,g/m,1 Hr,Valid
Shenyang,PM2.5,1/14/2017 10:00,2017,1,14,10,37,g/m,1 Hr,Valid
Shenyang,PM2.5,1/14/2017 11:00,2017,1,14,11,50,g/m,1 Hr,Valid
Shenyang,PM2.5,1/14/2017 12:00,2017,1,14,12,34,g/m,1 Hr,Valid
Shenyang,PM2.5,1/14/2017 13:00,2017,1,14,13,28,g/m,1 Hr,Valid
Shenyang,PM2.5,1/14/2017 14:00,2017,1,14,14,22,g/m,1 Hr,Valid
Shenyang,PM2.5,1/14/2017 15:00,2017,1,14,15,25,g/m,1 Hr,Valid
Shenyang,PM2.5,1/14/2017 16:00,2017,1,14,16,12,g/m,1 Hr,Valid
Shenyang,PM2.5,1/14/2017 17:00,2017,1,14,17,27,g/m,1 Hr,Valid
Shenyang,PM2.5,1/14/2017 18:00,2017,1,14,18,27,g/m,1 Hr,Valid
Shenyang,PM2.5,1/14/2017 19:00,2017,1,14,19,32,g/m,1 Hr,Valid
Shenyang,PM2.5,1/14/2017 20:00,2017,1,14,20,31,g/m,1 Hr,Valid
Shenyang,PM2.5,1/14/2017 21:00,2017,1,14,21,41,g/m,1 Hr,Valid
Shenyang,PM2.5,1/14/2017 22:00,2017,1,14,22,38,g/m,1 Hr,Valid
Shenyang,PM2.5,1/14/2017 23:00,2017,1,14,23,29,g/m,1 Hr,Valid
Shenyang,PM2.5,1/15/2017 0:00,2017,1,15,0,44,g/m,1 Hr,Valid
Shenyang,PM2.5,1/15/2017 1:00,2017,1,15,1,56,g/m,1 Hr,Valid
Shenyang,PM2.5,1/15/2017 2:00,2017,1,15,2,48,g/m,1 Hr,Valid
Shenyang,PM2.5,1/15/2017 3:00,2017,1,15,3,89,g/m,1 Hr,Valid
Shenyang,PM2.5,1/15/2017 4:00,2017,1,15,4,128,g/m,1 Hr,Valid
Shenyang,PM2.5,1/15/2017 5:00,2017,1,15,5,119,g/m,1 Hr,Valid
Shenyang,PM2.5,1/15/2017 6:00,2017,1,15,6,133,g/m,1 Hr,Valid
Shenyang,PM2.5,1/15/2017 7:00,2017,1,15,7,150,g/m,1 Hr,Valid
Shenyang,PM2.5,1/15/2017 8:00,2017,1,15,8,134,g/m,1 Hr,Valid
Shenyang,PM2.5,1/15/2017 9:00,2017,1,15,9,145,g/m,1 Hr,Valid
Shenyang,PM2.5,1/15/2017 10:00,2017,1,15,10,134,g/m,1 Hr,Valid
Shenyang,PM2.5,1/15/2017 11:00,2017,1,15,11,113,g/m,1 Hr,Valid
Shenyang,PM2.5,1/15/2017 12:00,2017,1,15,12,115,g/m,1 Hr,Valid
Shenyang,PM2.5,1/15/2017 13:00,2017,1,15,13,146,g/m,1 Hr,Valid
Shenyang,PM2.5,1/15/2017 14:00,2017,1,15,14,97,g/m,1 Hr,Valid
Shenyang,PM2.5,1/15/2017 15:00,2017,1,15,15,84,g/m,1 Hr,Valid
Shenyang,PM2.5,1/15/2017 16:00,2017,1,15,16,76,g/m,1 Hr,Valid
Shenyang,PM2.5,1/15/2017 17:00,2017,1,15,17,90,g/m,1 Hr,Valid
Shenyang,PM2.5,1/15/2017 18:00,2017,1,15,18,80,g/m,1 Hr,Valid
Shenyang,PM2.5,1/15/2017 19:00,2017,1,15,19,87,g/m,1 Hr,Valid
Shenyang,PM2.5,1/15/2017 20:00,2017,1,15,20,88,g/m,1 Hr,Valid
Shenyang,PM2.5,1/15/2017 21:00,2017,1,15,21,100,g/m,1 Hr,Valid
Shenyang,PM2.5,1/15/2017 22:00,2017,1,15,22,134,g/m,1 Hr,Valid
Shenyang,PM2.5,1/15/2017 23:00,2017,1,15,23,202,g/m,1 Hr,Valid
Shenyang,PM2.5,1/16/2017 0:00,2017,1,16,0,199,g/m,1 Hr,Valid
Shenyang,PM2.5,1/16/2017 1:00,2017,1,16,1,174,g/m,1 Hr,Valid
Shenyang,PM2.5,1/16/2017 2:00,2017,1,16,2,174,g/m,1 Hr,Valid
Shenyang,PM2.5,1/16/2017 3:00,2017,1,16,3,228,g/m,1 Hr,Valid
Shenyang,PM2.5,1/16/2017 4:00,2017,1,16,4,251,g/m,1 Hr,Valid
Shenyang,PM2.5,1/16/2017 5:00,2017,1,16,5,205,g/m,1 Hr,Valid
Shenyang,PM2.5,1/16/2017 6:00,2017,1,16,6,227,g/m,1 Hr,Valid
Shenyang,PM2.5,1/16/2017 7:00,2017,1,16,7,232,g/m,1 Hr,Valid
Shenyang,PM2.5,1/16/2017 8:00,2017,1,16,8,187,g/m,1 Hr,Valid
Shenyang,PM2.5,1/16/2017 9:00,2017,1,16,9,182,g/m,1 Hr,Valid
Shenyang,PM2.5,1/16/2017 10:00,2017,1,16,10,172,g/m,1 Hr,Valid
Shenyang,PM2.5,1/16/2017 11:00,2017,1,16,11,135,g/m,1 Hr,Valid
Shenyang,PM2.5,1/16/2017 12:00,2017,1,16,12,67,g/m,1 Hr,Valid
Shenyang,PM2.5,1/16/2017 13:00,2017,1,16,13,66,g/m,1 Hr,Valid
Shenyang,PM2.5,1/16/2017 14:00,2017,1,16,14,58,g/m,1 Hr,Valid
Shenyang,PM2.5,1/16/2017 15:00,2017,1,16,15,41,g/m,1 Hr,Valid
Shenyang,PM2.5,1/16/2017 16:00,2017,1,16,16,57,g/m,1 Hr,Valid
Shenyang,PM2.5,1/16/2017 17:00,2017,1,16,17,54,g/m,1 Hr,Valid
Shenyang,PM2.5,1/16/2017 18:00,2017,1,16,18,64,g/m,1 Hr,Valid
Shenyang,PM2.5,1/16/2017 19:00,2017,1,16,19,60,g/m,1 Hr,Valid
Shenyang,PM2.5,1/16/2017 20:00,2017,1,16,20,71,g/m,1 Hr,Valid
Shenyang,PM2.5,1/16/2017 21:00,2017,1,16,21,92,g/m,1 Hr,Valid
Shenyang,PM2.5,1/16/2017 22:00,2017,1,16,22,99,g/m,1 Hr,Valid
Shenyang,PM2.5,1/16/2017 23:00,2017,1,16,23,95,g/m,1 Hr,Valid
Shenyang,PM2.5,1/17/2017 0:00,2017,1,17,0,116,g/m,1 Hr,Valid
Shenyang,PM2.5,1/17/2017 1:00,2017,1,17,1,128,g/m,1 Hr,Valid
Shenyang,PM2.5,1/17/2017 2:00,2017,1,17,2,143,g/m,1 Hr,Valid
Shenyang,PM2.5,1/17/2017 3:00,2017,1,17,3,125,g/m,1 Hr,Valid
Shenyang,PM2.5,1/17/2017 4:00,2017,1,17,4,132,g/m,1 Hr,Valid
Shenyang,PM2.5,1/17/2017 5:00,2017,1,17,5,160,g/m,1 Hr,Valid
Shenyang,PM2.5,1/17/2017 6:00,2017,1,17,6,165,g/m,1 Hr,Valid
Shenyang,PM2.5,1/17/2017 7:00,2017,1,17,7,179,g/m,1 Hr,Valid
Shenyang,PM2.5,1/17/2017 8:00,2017,1,17,8,173,g/m,1 Hr,Valid
Shenyang,PM2.5,1/17/2017 9:00,2017,1,17,9,180,g/m,1 Hr,Valid
Shenyang,PM2.5,1/17/2017 10:00,2017,1,17,10,177,g/m,1 Hr,Valid
Shenyang,PM2.5,1/17/2017 11:00,2017,1,17,11,186,g/m,1 Hr,Valid
Shenyang,PM2.5,1/17/2017 12:00,2017,1,17,12,218,g/m,1 Hr,Valid
Shenyang,PM2.5,1/17/2017 13:00,2017,1,17,13,176,g/m,1 Hr,Valid
Shenyang,PM2.5,1/17/2017 14:00,2017,1,17,14,152,g/m,1 Hr,Valid
Shenyang,PM2.5,1/17/2017 15:00,2017,1,17,15,153,g/m,1 Hr,Valid
Shenyang,PM2.5,1/17/2017 16:00,2017,1,17,16,155,g/m,1 Hr,Valid
Shenyang,PM2.5,1/17/2017 17:00,2017,1,17,17,144,g/m,1 Hr,Valid
Shenyang,PM2.5,1/17/2017 18:00,2017,1,17,18,111,g/m,1 Hr,Valid
Shenyang,PM2.5,1/17/2017 19:00,2017,1,17,19,121,g/m,1 Hr,Valid
Shenyang,PM2.5,1/17/2017 20:00,2017,1,17,20,126,g/m,1 Hr,Valid
Shenyang,PM2.5,1/17/2017 21:00,2017,1,17,21,129,g/m,1 Hr,Valid
Shenyang,PM2.5,1/17/2017 22:00,2017,1,17,22,196,g/m,1 Hr,Valid
Shenyang,PM2.5,1/17/2017 23:00,2017,1,17,23,134,g/m,1 Hr,Valid
Shenyang,PM2.5,1/18/2017 0:00,2017,1,18,0,176,g/m,1 Hr,Valid
Shenyang,PM2.5,1/18/2017 1:00,2017,1,18,1,179,g/m,1 Hr,Valid
Shenyang,PM2.5,1/18/2017 2:00,2017,1,18,2,170,g/m,1 Hr,Valid
Shenyang,PM2.5,1/18/2017 3:00,2017,1,18,3,170,g/m,1 Hr,Valid
Shenyang,PM2.5,1/18/2017 4:00,2017,1,18,4,171,g/m,1 Hr,Valid
Shenyang,PM2.5,1/18/2017 5:00,2017,1,18,5,194,g/m,1 Hr,Valid
Shenyang,PM2.5,1/18/2017 6:00,2017,1,18,6,206,g/m,1 Hr,Valid
Shenyang,PM2.5,1/18/2017 7:00,2017,1,18,7,181,g/m,1 Hr,Valid
Shenyang,PM2.5,1/18/2017 8:00,2017,1,18,8,135,g/m,1 Hr,Valid
Shenyang,PM2.5,1/18/2017 9:00,2017,1,18,9,132,g/m,1 Hr,Valid
Shenyang,PM2.5,1/18/2017 10:00,2017,1,18,10,120,g/m,1 Hr,Valid
Shenyang,PM2.5,1/18/2017 11:00,2017,1,18,11,-999,g/m,1 Hr,Missing
Shenyang,PM2.5,1/18/2017 12:00,2017,1,18,12,136,g/m,1 Hr,Valid
Shenyang,PM2.5,1/18/2017 13:00,2017,1,18,13,120,g/m,1 Hr,Valid
Shenyang,PM2.5,1/18/2017 14:00,2017,1,18,14,84,g/m,1 Hr,Valid
Shenyang,PM2.5,1/18/2017 15:00,2017,1,18,15,56,g/m,1 Hr,Valid
Shenyang,PM2.5,1/18/2017 16:00,2017,1,18,16,56,g/m,1 Hr,Valid
Shenyang,PM2.5,1/18/2017 17:00,2017,1,18,17,51,g/m,1 Hr,Valid
Shenyang,PM2.5,1/18/2017 18:00,2017,1,18,18,32,g/m,1 Hr,Valid
Shenyang,PM2.5,1/18/2017 19:00,2017,1,18,19,101,g/m,1 Hr,Valid
Shenyang,PM2.5,1/18/2017 20:00,2017,1,18,20,107,g/m,1 Hr,Valid
Shenyang,PM2.5,1/18/2017 21:00,2017,1,18,21,104,g/m,1 Hr,Valid
Shenyang,PM2.5,1/18/2017 22:00,2017,1,18,22,128,g/m,1 Hr,Valid
Shenyang,PM2.5,1/18/2017 23:00,2017,1,18,23,144,g/m,1 Hr,Valid
Shenyang,PM2.5,1/19/2017 0:00,2017,1,19,0,171,g/m,1 Hr,Valid
Shenyang,PM2.5,1/19/2017 1:00,2017,1,19,1,196,g/m,1 Hr,Valid
Shenyang,PM2.5,1/19/2017 2:00,2017,1,19,2,221,g/m,1 Hr,Valid
Shenyang,PM2.5,1/19/2017 3:00,2017,1,19,3,200,g/m,1 Hr,Valid
Shenyang,PM2.5,1/19/2017 4:00,2017,1,19,4,197,g/m,1 Hr,Valid
Shenyang,PM2.5,1/19/2017 5:00,2017,1,19,5,266,g/m,1 Hr,Valid
Shenyang,PM2.5,1/19/2017 6:00,2017,1,19,6,286,g/m,1 Hr,Valid
Shenyang,PM2.5,1/19/2017 7:00,2017,1,19,7,254,g/m,1 Hr,Valid
Shenyang,PM2.5,1/19/2017 8:00,2017,1,19,8,237,g/m,1 Hr,Valid
Shenyang,PM2.5,1/19/2017 9:00,2017,1,19,9,227,g/m,1 Hr,Valid
Shenyang,PM2.5,1/19/2017 10:00,2017,1,19,10,248,g/m,1 Hr,Valid
Shenyang,PM2.5,1/19/2017 11:00,2017,1,19,11,171,g/m,1 Hr,Valid
Shenyang,PM2.5,1/19/2017 12:00,2017,1,19,12,102,g/m,1 Hr,Valid
Shenyang,PM2.5,1/19/2017 13:00,2017,1,19,13,141,g/m,1 Hr,Valid
Shenyang,PM2.5,1/19/2017 14:00,2017,1,19,14,112,g/m,1 Hr,Valid
Shenyang,PM2.5,1/19/2017 15:00,2017,1,19,15,102,g/m,1 Hr,Valid
Shenyang,PM2.5,1/19/2017 16:00,2017,1,19,16,61,g/m,1 Hr,Valid
Shenyang,PM2.5,1/19/2017 17:00,2017,1,19,17,43,g/m,1 Hr,Valid
Shenyang,PM2.5,1/19/2017 18:00,2017,1,19,18,39,g/m,1 Hr,Valid
Shenyang,PM2.5,1/19/2017 19:00,2017,1,19,19,45,g/m,1 Hr,Valid
Shenyang,PM2.5,1/19/2017 20:00,2017,1,19,20,45,g/m,1 Hr,Valid
Shenyang,PM2.5,1/19/2017 21:00,2017,1,19,21,31,g/m,1 Hr,Valid
Shenyang,PM2.5,1/19/2017 22:00,2017,1,19,22,33,g/m,1 Hr,Valid
Shenyang,PM2.5,1/19/2017 23:00,2017,1,19,23,17,g/m,1 Hr,Valid
Shenyang,PM2.5,1/20/2017 0:00,2017,1,20,0,18,g/m,1 Hr,Valid
Shenyang,PM2.5,1/20/2017 1:00,2017,1,20,1,21,g/m,1 Hr,Valid
Shenyang,PM2.5,1/20/2017 2:00,2017,1,20,2,20,g/m,1 Hr,Valid
Shenyang,PM2.5,1/20/2017 3:00,2017,1,20,3,21,g/m,1 Hr,Valid
Shenyang,PM2.5,1/20/2017 4:00,2017,1,20,4,17,g/m,1 Hr,Valid
Shenyang,PM2.5,1/20/2017 5:00,2017,1,20,5,17,g/m,1 Hr,Valid
Shenyang,PM2.5,1/20/2017 6:00,2017,1,20,6,26,g/m,1 Hr,Valid
Shenyang,PM2.5,1/20/2017 7:00,2017,1,20,7,26,g/m,1 Hr,Valid
Shenyang,PM2.5,1/20/2017 8:00,2017,1,20,8,29,g/m,1 Hr,Valid
Shenyang,PM2.5,1/20/2017 9:00,2017,1,20,9,33,g/m,1 Hr,Valid
Shenyang,PM2.5,1/20/2017 10:00,2017,1,20,10,34,g/m,1 Hr,Valid
Shenyang,PM2.5,1/20/2017 11:00,2017,1,20,11,41,g/m,1 Hr,Valid
Shenyang,PM2.5,1/20/2017 12:00,2017,1,20,12,47,g/m,1 Hr,Valid
Shenyang,PM2.5,1/20/2017 13:00,2017,1,20,13,39,g/m,1 Hr,Valid
Shenyang,PM2.5,1/20/2017 14:00,2017,1,20,14,42,g/m,1 Hr,Valid
Shenyang,PM2.5,1/20/2017 15:00,2017,1,20,15,36,g/m,1 Hr,Valid
Shenyang,PM2.5,1/20/2017 16:00,2017,1,20,16,42,g/m,1 Hr,Valid
Shenyang,PM2.5,1/20/2017 17:00,2017,1,20,17,42,g/m,1 Hr,Valid
Shenyang,PM2.5,1/20/2017 18:00,2017,1,20,18,55,g/m,1 Hr,Valid
Shenyang,PM2.5,1/20/2017 19:00,2017,1,20,19,74,g/m,1 Hr,Valid
Shenyang,PM2.5,1/20/2017 20:00,2017,1,20,20,64,g/m,1 Hr,Valid
Shenyang,PM2.5,1/20/2017 21:00,2017,1,20,21,65,g/m,1 Hr,Valid
Shenyang,PM2.5,1/20/2017 22:00,2017,1,20,22,59,g/m,1 Hr,Valid
Shenyang,PM2.5,1/20/2017 23:00,2017,1,20,23,60,g/m,1 Hr,Valid
Shenyang,PM2.5,1/21/2017 0:00,2017,1,21,0,61,g/m,1 Hr,Valid
Shenyang,PM2.5,1/21/2017 1:00,2017,1,21,1,78,g/m,1 Hr,Valid
Shenyang,PM2.5,1/21/2017 2:00,2017,1,21,2,79,g/m,1 Hr,Valid
Shenyang,PM2.5,1/21/2017 3:00,2017,1,21,3,83,g/m,1 Hr,Valid
Shenyang,PM2.5,1/21/2017 4:00,2017,1,21,4,96,g/m,1 Hr,Valid
Shenyang,PM2.5,1/21/2017 5:00,2017,1,21,5,100,g/m,1 Hr,Valid
Shenyang,PM2.5,1/21/2017 6:00,2017,1,21,6,116,g/m,1 Hr,Valid
Shenyang,PM2.5,1/21/2017 7:00,2017,1,21,7,117,g/m,1 Hr,Valid
Shenyang,PM2.5,1/21/2017 8:00,2017,1,21,8,110,g/m,1 Hr,Valid
Shenyang,PM2.5,1/21/2017 9:00,2017,1,21,9,108,g/m,1 Hr,Valid
Shenyang,PM2.5,1/21/2017 10:00,2017,1,21,10,83,g/m,1 Hr,Valid
Shenyang,PM2.5,1/21/2017 11:00,2017,1,21,11,71,g/m,1 Hr,Valid
Shenyang,PM2.5,1/21/2017 12:00,2017,1,21,12,31,g/m,1 Hr,Valid
Shenyang,PM2.5,1/21/2017 13:00,2017,1,21,13,37,g/m,1 Hr,Valid
Shenyang,PM2.5,1/21/2017 14:00,2017,1,21,14,22,g/m,1 Hr,Valid
Shenyang,PM2.5,1/21/2017 15:00,2017,1,21,15,20,g/m,1 Hr,Valid
Shenyang,PM2.5,1/21/2017 16:00,2017,1,21,16,9,g/m,1 Hr,Valid
Shenyang,PM2.5,1/21/2017 17:00,2017,1,21,17,15,g/m,1 Hr,Valid
Shenyang,PM2.5,1/21/2017 18:00,2017,1,21,18,31,g/m,1 Hr,Valid
Shenyang,PM2.5,1/21/2017 19:00,2017,1,21,19,26,g/m,1 Hr,Valid
Shenyang,PM2.5,1/21/2017 20:00,2017,1,21,20,25,g/m,1 Hr,Valid
Shenyang,PM2.5,1/21/2017 21:00,2017,1,21,21,28,g/m,1 Hr,Valid
Shenyang,PM2.5,1/21/2017 22:00,2017,1,21,22,23,g/m,1 Hr,Valid
Shenyang,PM2.5,1/21/2017 23:00,2017,1,21,23,23,g/m,1 Hr,Valid
Shenyang,PM2.5,1/22/2017 0:00,2017,1,22,0,25,g/m,1 Hr,Valid
Shenyang,PM2.5,1/22/2017 1:00,2017,1,22,1,30,g/m,1 Hr,Valid
Shenyang,PM2.5,1/22/2017 2:00,2017,1,22,2,22,g/m,1 Hr,Valid
Shenyang,PM2.5,1/22/2017 3:00,2017,1,22,3,24,g/m,1 Hr,Valid
Shenyang,PM2.5,1/22/2017 4:00,2017,1,22,4,25,g/m,1 Hr,Valid
Shenyang,PM2.5,1/22/2017 5:00,2017,1,22,5,28,g/m,1 Hr,Valid
Shenyang,PM2.5,1/22/2017 6:00,2017,1,22,6,27,g/m,1 Hr,Valid
Shenyang,PM2.5,1/22/2017 7:00,2017,1,22,7,35,g/m,1 Hr,Valid
Shenyang,PM2.5,1/22/2017 8:00,2017,1,22,8,34,g/m,1 Hr,Valid
Shenyang,PM2.5,1/22/2017 9:00,2017,1,22,9,44,g/m,1 Hr,Valid
Shenyang,PM2.5,1/22/2017 10:00,2017,1,22,10,58,g/m,1 Hr,Valid
Shenyang,PM2.5,1/22/2017 11:00,2017,1,22,11,67,g/m,1 Hr,Valid
Shenyang,PM2.5,1/22/2017 12:00,2017,1,22,12,79,g/m,1 Hr,Valid
Shenyang,PM2.5,1/22/2017 13:00,2017,1,22,13,76,g/m,1 Hr,Valid
Shenyang,PM2.5,1/22/2017 14:00,2017,1,22,14,62,g/m,1 Hr,Valid
Shenyang,PM2.5,1/22/2017 15:00,2017,1,22,15,56,g/m,1 Hr,Valid
Shenyang,PM2.5,1/22/2017 16:00,2017,1,22,16,62,g/m,1 Hr,Valid
Shenyang,PM2.5,1/22/2017 17:00,2017,1,22,17,55,g/m,1 Hr,Valid
Shenyang,PM2.5,1/22/2017 18:00,2017,1,22,18,56,g/m,1 Hr,Valid
Shenyang,PM2.5,1/22/2017 19:00,2017,1,22,19,83,g/m,1 Hr,Valid
Shenyang,PM2.5,1/22/2017 20:00,2017,1,22,20,119,g/m,1 Hr,Valid
Shenyang,PM2.5,1/22/2017 21:00,2017,1,22,21,113,g/m,1 Hr,Valid
Shenyang,PM2.5,1/22/2017 22:00,2017,1,22,22,124,g/m,1 Hr,Valid
Shenyang,PM2.5,1/22/2017 23:00,2017,1,22,23,123,g/m,1 Hr,Valid
Shenyang,PM2.5,1/23/2017 0:00,2017,1,23,0,145,g/m,1 Hr,Valid
Shenyang,PM2.5,1/23/2017 1:00,2017,1,23,1,164,g/m,1 Hr,Valid
Shenyang,PM2.5,1/23/2017 2:00,2017,1,23,2,174,g/m,1 Hr,Valid
Shenyang,PM2.5,1/23/2017 3:00,2017,1,23,3,178,g/m,1 Hr,Valid
Shenyang,PM2.5,1/23/2017 4:00,2017,1,23,4,182,g/m,1 Hr,Valid
Shenyang,PM2.5,1/23/2017 5:00,2017,1,23,5,203,g/m,1 Hr,Valid
Shenyang,PM2.5,1/23/2017 6:00,2017,1,23,6,211,g/m,1 Hr,Valid
Shenyang,PM2.5,1/23/2017 7:00,2017,1,23,7,224,g/m,1 Hr,Valid
Shenyang,PM2.5,1/23/2017 8:00,2017,1,23,8,183,g/m,1 Hr,Valid
Shenyang,PM2.5,1/23/2017 9:00,2017,1,23,9,174,g/m,1 Hr,Valid
Shenyang,PM2.5,1/23/2017 10:00,2017,1,23,10,176,g/m,1 Hr,Valid
Shenyang,PM2.5,1/23/2017 11:00,2017,1,23,11,185,g/m,1 Hr,Valid
Shenyang,PM2.5,1/23/2017 12:00,2017,1,23,12,146,g/m,1 Hr,Valid
Shenyang,PM2.5,1/23/2017 13:00,2017,1,23,13,80,g/m,1 Hr,Valid
Shenyang,PM2.5,1/23/2017 14:00,2017,1,23,14,32,g/m,1 Hr,Valid
Shenyang,PM2.5,1/23/2017 15:00,2017,1,23,15,33,g/m,1 Hr,Valid
Shenyang,PM2.5,1/23/2017 16:00,2017,1,23,16,22,g/m,1 Hr,Valid
Shenyang,PM2.5,1/23/2017 17:00,2017,1,23,17,28,g/m,1 Hr,Valid
Shenyang,PM2.5,1/23/2017 18:00,2017,1,23,18,30,g/m,1 Hr,Valid
Shenyang,PM2.5,1/23/2017 19:00,2017,1,23,19,40,g/m,1 Hr,Valid
Shenyang,PM2.5,1/23/2017 20:00,2017,1,23,20,96,g/m,1 Hr,Valid
Shenyang,PM2.5,1/23/2017 21:00,2017,1,23,21,81,g/m,1 Hr,Valid
Shenyang,PM2.5,1/23/2017 22:00,2017,1,23,22,89,g/m,1 Hr,Valid
Shenyang,PM2.5,1/23/2017 23:00,2017,1,23,23,82,g/m,1 Hr,Valid
Shenyang,PM2.5,1/24/2017 0:00,2017,1,24,0,84,g/m,1 Hr,Valid
Shenyang,PM2.5,1/24/2017 1:00,2017,1,24,1,108,g/m,1 Hr,Valid
Shenyang,PM2.5,1/24/2017 2:00,2017,1,24,2,152,g/m,1 Hr,Valid
Shenyang,PM2.5,1/24/2017 3:00,2017,1,24,3,156,g/m,1 Hr,Valid
Shenyang,PM2.5,1/24/2017 4:00,2017,1,24,4,224,g/m,1 Hr,Valid
Shenyang,PM2.5,1/24/2017 5:00,2017,1,24,5,245,g/m,1 Hr,Valid
Shenyang,PM2.5,1/24/2017 6:00,2017,1,24,6,256,g/m,1 Hr,Valid
Shenyang,PM2.5,1/24/2017 7:00,2017,1,24,7,270,g/m,1 Hr,Valid
Shenyang,PM2.5,1/24/2017 8:00,2017,1,24,8,260,g/m,1 Hr,Valid
Shenyang,PM2.5,1/24/2017 9:00,2017,1,24,9,262,g/m,1 Hr,Valid
Shenyang,PM2.5,1/24/2017 10:00,2017,1,24,10,289,g/m,1 Hr,Valid
Shenyang,PM2.5,1/24/2017 11:00,2017,1,24,11,250,g/m,1 Hr,Valid
Shenyang,PM2.5,1/24/2017 12:00,2017,1,24,12,165,g/m,1 Hr,Valid
Shenyang,PM2.5,1/24/2017 13:00,2017,1,24,13,147,g/m,1 Hr,Valid
Shenyang,PM2.5,1/24/2017 14:00,2017,1,24,14,157,g/m,1 Hr,Valid
Shenyang,PM2.5,1/24/2017 15:00,2017,1,24,15,128,g/m,1 Hr,Valid
Shenyang,PM2.5,1/24/2017 16:00,2017,1,24,16,97,g/m,1 Hr,Valid
Shenyang,PM2.5,1/24/2017 17:00,2017,1,24,17,71,g/m,1 Hr,Valid
Shenyang,PM2.5,1/24/2017 18:00,2017,1,24,18,87,g/m,1 Hr,Valid
Shenyang,PM2.5,1/24/2017 19:00,2017,1,24,19,105,g/m,1 Hr,Valid
Shenyang,PM2.5,1/24/2017 20:00,2017,1,24,20,95,g/m,1 Hr,Valid
Shenyang,PM2.5,1/24/2017 21:00,2017,1,24,21,99,g/m,1 Hr,Valid
Shenyang,PM2.5,1/24/2017 22:00,2017,1,24,22,93,g/m,1 Hr,Valid
Shenyang,PM2.5,1/24/2017 23:00,2017,1,24,23,152,g/m,1 Hr,Valid
Shenyang,PM2.5,1/25/2017 0:00,2017,1,25,0,169,g/m,1 Hr,Valid
Shenyang,PM2.5,1/25/2017 1:00,2017,1,25,1,177,g/m,1 Hr,Valid
Shenyang,PM2.5,1/25/2017 2:00,2017,1,25,2,184,g/m,1 Hr,Valid
Shenyang,PM2.5,1/25/2017 3:00,2017,1,25,3,211,g/m,1 Hr,Valid
Shenyang,PM2.5,1/25/2017 4:00,2017,1,25,4,193,g/m,1 Hr,Valid
Shenyang,PM2.5,1/25/2017 5:00,2017,1,25,5,192,g/m,1 Hr,Valid
Shenyang,PM2.5,1/25/2017 6:00,2017,1,25,6,195,g/m,1 Hr,Valid
Shenyang,PM2.5,1/25/2017 7:00,2017,1,25,7,194,g/m,1 Hr,Valid
Shenyang,PM2.5,1/25/2017 8:00,2017,1,25,8,188,g/m,1 Hr,Valid
Shenyang,PM2.5,1/25/2017 9:00,2017,1,25,9,207,g/m,1 Hr,Valid
Shenyang,PM2.5,1/25/2017 10:00,2017,1,25,10,239,g/m,1 Hr,Valid
Shenyang,PM2.5,1/25/2017 11:00,2017,1,25,11,195,g/m,1 Hr,Valid
Shenyang,PM2.5,1/25/2017 12:00,2017,1,25,12,143,g/m,1 Hr,Valid
Shenyang,PM2.5,1/25/2017 13:00,2017,1,25,13,108,g/m,1 Hr,Valid
Shenyang,PM2.5,1/25/2017 14:00,2017,1,25,14,116,g/m,1 Hr,Valid
Shenyang,PM2.5,1/25/2017 15:00,2017,1,25,15,128,g/m,1 Hr,Valid
Shenyang,PM2.5,1/25/2017 16:00,2017,1,25,16,109,g/m,1 Hr,Valid
Shenyang,PM2.5,1/25/2017 17:00,2017,1,25,17,89,g/m,1 Hr,Valid
Shenyang,PM2.5,1/25/2017 18:00,2017,1,25,18,133,g/m,1 Hr,Valid
Shenyang,PM2.5,1/25/2017 19:00,2017,1,25,19,145,g/m,1 Hr,Valid
Shenyang,PM2.5,1/25/2017 20:00,2017,1,25,20,154,g/m,1 Hr,Valid
Shenyang,PM2.5,1/25/2017 21:00,2017,1,25,21,106,g/m,1 Hr,Valid
Shenyang,PM2.5,1/25/2017 22:00,2017,1,25,22,91,g/m,1 Hr,Valid
Shenyang,PM2.5,1/25/2017 23:00,2017,1,25,23,79,g/m,1 Hr,Valid
Shenyang,PM2.5,1/26/2017 0:00,2017,1,26,0,91,g/m,1 Hr,Valid
Shenyang,PM2.5,1/26/2017 1:00,2017,1,26,1,87,g/m,1 Hr,Valid
Shenyang,PM2.5,1/26/2017 2:00,2017,1,26,2,94,g/m,1 Hr,Valid
Shenyang,PM2.5,1/26/2017 3:00,2017,1,26,3,83,g/m,1 Hr,Valid
Shenyang,PM2.5,1/26/2017 4:00,2017,1,26,4,86,g/m,1 Hr,Valid
Shenyang,PM2.5,1/26/2017 5:00,2017,1,26,5,89,g/m,1 Hr,Valid
Shenyang,PM2.5,1/26/2017 6:00,2017,1,26,6,88,g/m,1 Hr,Valid
Shenyang,PM2.5,1/26/2017 7:00,2017,1,26,7,84,g/m,1 Hr,Valid
Shenyang,PM2.5,1/26/2017 8:00,2017,1,26,8,98,g/m,1 Hr,Valid
Shenyang,PM2.5,1/26/2017 9:00,2017,1,26,9,100,g/m,1 Hr,Valid
Shenyang,PM2.5,1/26/2017 10:00,2017,1,26,10,100,g/m,1 Hr,Valid
Shenyang,PM2.5,1/26/2017 11:00,2017,1,26,11,99,g/m,1 Hr,Valid
Shenyang,PM2.5,1/26/2017 12:00,2017,1,26,12,97,g/m,1 Hr,Valid
Shenyang,PM2.5,1/26/2017 13:00,2017,1,26,13,133,g/m,1 Hr,Valid
Shenyang,PM2.5,1/26/2017 14:00,2017,1,26,14,129,g/m,1 Hr,Valid
Shenyang,PM2.5,1/26/2017 15:00,2017,1,26,15,118,g/m,1 Hr,Valid
Shenyang,PM2.5,1/26/2017 16:00,2017,1,26,16,21,g/m,1 Hr,Valid
Shenyang,PM2.5,1/26/2017 17:00,2017,1,26,17,26,g/m,1 Hr,Valid
Shenyang,PM2.5,1/26/2017 18:00,2017,1,26,18,30,g/m,1 Hr,Valid
Shenyang,PM2.5,1/26/2017 19:00,2017,1,26,19,55,g/m,1 Hr,Valid
Shenyang,PM2.5,1/26/2017 20:00,2017,1,26,20,49,g/m,1 Hr,Valid
Shenyang,PM2.5,1/26/2017 21:00,2017,1,26,21,48,g/m,1 Hr,Valid
Shenyang,PM2.5,1/26/2017 22:00,2017,1,26,22,32,g/m,1 Hr,Valid
Shenyang,PM2.5,1/26/2017 23:00,2017,1,26,23,26,g/m,1 Hr,Valid
Shenyang,PM2.5,1/27/2017 0:00,2017,1,27,0,16,g/m,1 Hr,Valid
Shenyang,PM2.5,1/27/2017 1:00,2017,1,27,1,18,g/m,1 Hr,Valid
Shenyang,PM2.5,1/27/2017 2:00,2017,1,27,2,16,g/m,1 Hr,Valid
Shenyang,PM2.5,1/27/2017 3:00,2017,1,27,3,20,g/m,1 Hr,Valid
Shenyang,PM2.5,1/27/2017 4:00,2017,1,27,4,10,g/m,1 Hr,Valid
Shenyang,PM2.5,1/27/2017 5:00,2017,1,27,5,13,g/m,1 Hr,Valid
Shenyang,PM2.5,1/27/2017 6:00,2017,1,27,6,27,g/m,1 Hr,Valid
Shenyang,PM2.5,1/27/2017 7:00,2017,1,27,7,34,g/m,1 Hr,Valid
Shenyang,PM2.5,1/27/2017 8:00,2017,1,27,8,27,g/m,1 Hr,Valid
Shenyang,PM2.5,1/27/2017 9:00,2017,1,27,9,36,g/m,1 Hr,Valid
Shenyang,PM2.5,1/27/2017 10:00,2017,1,27,10,61,g/m,1 Hr,Valid
Shenyang,PM2.5,1/27/2017 11:00,2017,1,27,11,56,g/m,1 Hr,Valid
Shenyang,PM2.5,1/27/2017 12:00,2017,1,27,12,36,g/m,1 Hr,Valid
Shenyang,PM2.5,1/27/2017 13:00,2017,1,27,13,30,g/m,1 Hr,Valid
Shenyang,PM2.5,1/27/2017 14:00,2017,1,27,14,10,g/m,1 Hr,Valid
Shenyang,PM2.5,1/27/2017 15:00,2017,1,27,15,43,g/m,1 Hr,Valid
Shenyang,PM2.5,1/27/2017 16:00,2017,1,27,16,40,g/m,1 Hr,Valid
Shenyang,PM2.5,1/27/2017 17:00,2017,1,27,17,39,g/m,1 Hr,Valid
Shenyang,PM2.5,1/27/2017 18:00,2017,1,27,18,41,g/m,1 Hr,Valid
Shenyang,PM2.5,1/27/2017 19:00,2017,1,27,19,49,g/m,1 Hr,Valid
Shenyang,PM2.5,1/27/2017 20:00,2017,1,27,20,59,g/m,1 Hr,Valid
Shenyang,PM2.5,1/27/2017 21:00,2017,1,27,21,74,g/m,1 Hr,Valid
Shenyang,PM2.5,1/27/2017 22:00,2017,1,27,22,49,g/m,1 Hr,Valid
Shenyang,PM2.5,1/27/2017 23:00,2017,1,27,23,72,g/m,1 Hr,Valid
Shenyang,PM2.5,1/28/2017 0:00,2017,1,28,0,174,g/m,1 Hr,Valid
Shenyang,PM2.5,1/28/2017 1:00,2017,1,28,1,164,g/m,1 Hr,Valid
Shenyang,PM2.5,1/28/2017 2:00,2017,1,28,2,55,g/m,1 Hr,Valid
Shenyang,PM2.5,1/28/2017 3:00,2017,1,28,3,39,g/m,1 Hr,Valid
Shenyang,PM2.5,1/28/2017 4:00,2017,1,28,4,36,g/m,1 Hr,Valid
Shenyang,PM2.5,1/28/2017 5:00,2017,1,28,5,25,g/m,1 Hr,Valid
Shenyang,PM2.5,1/28/2017 6:00,2017,1,28,6,45,g/m,1 Hr,Valid
Shenyang,PM2.5,1/28/2017 7:00,2017,1,28,7,53,g/m,1 Hr,Valid
Shenyang,PM2.5,1/28/2017 8:00,2017,1,28,8,53,g/m,1 Hr,Valid
Shenyang,PM2.5,1/28/2017 9:00,2017,1,28,9,71,g/m,1 Hr,Valid
Shenyang,PM2.5,1/28/2017 10:00,2017,1,28,10,80,g/m,1 Hr,Valid
Shenyang,PM2.5,1/28/2017 11:00,2017,1,28,11,40,g/m,1 Hr,Valid
Shenyang,PM2.5,1/28/2017 12:00,2017,1,28,12,24,g/m,1 Hr,Valid
Shenyang,PM2.5,1/28/2017 13:00,2017,1,28,13,28,g/m,1 Hr,Valid
Shenyang,PM2.5,1/28/2017 14:00,2017,1,28,14,29,g/m,1 Hr,Valid
Shenyang,PM2.5,1/28/2017 15:00,2017,1,28,15,33,g/m,1 Hr,Valid
Shenyang,PM2.5,1/28/2017 16:00,2017,1,28,16,47,g/m,1 Hr,Valid
Shenyang,PM2.5,1/28/2017 17:00,2017,1,28,17,52,g/m,1 Hr,Valid
Shenyang,PM2.5,1/28/2017 18:00,2017,1,28,18,46,g/m,1 Hr,Valid
Shenyang,PM2.5,1/28/2017 19:00,2017,1,28,19,53,g/m,1 Hr,Valid
Shenyang,PM2.5,1/28/2017 20:00,2017,1,28,20,38,g/m,1 Hr,Valid
Shenyang,PM2.5,1/28/2017 21:00,2017,1,28,21,32,g/m,1 Hr,Valid
Shenyang,PM2.5,1/28/2017 22:00,2017,1,28,22,57,g/m,1 Hr,Valid
Shenyang,PM2.5,1/28/2017 23:00,2017,1,28,23,39,g/m,1 Hr,Valid
Shenyang,PM2.5,1/29/2017 0:00,2017,1,29,0,45,g/m,1 Hr,Valid
Shenyang,PM2.5,1/29/2017 1:00,2017,1,29,1,42,g/m,1 Hr,Valid
Shenyang,PM2.5,1/29/2017 2:00,2017,1,29,2,30,g/m,1 Hr,Valid
Shenyang,PM2.5,1/29/2017 3:00,2017,1,29,3,29,g/m,1 Hr,Valid
Shenyang,PM2.5,1/29/2017 4:00,2017,1,29,4,26,g/m,1 Hr,Valid
Shenyang,PM2.5,1/29/2017 5:00,2017,1,29,5,31,g/m,1 Hr,Valid
Shenyang,PM2.5,1/29/2017 6:00,2017,1,29,6,145,g/m,1 Hr,Valid
Shenyang,PM2.5,1/29/2017 7:00,2017,1,29,7,108,g/m,1 Hr,Valid
Shenyang,PM2.5,1/29/2017 8:00,2017,1,29,8,88,g/m,1 Hr,Valid
Shenyang,PM2.5,1/29/2017 9:00,2017,1,29,9,69,g/m,1 Hr,Valid
Shenyang,PM2.5,1/29/2017 10:00,2017,1,29,10,66,g/m,1 Hr,Valid
Shenyang,PM2.5,1/29/2017 11:00,2017,1,29,11,51,g/m,1 Hr,Valid
Shenyang,PM2.5,1/29/2017 12:00,2017,1,29,12,51,g/m,1 Hr,Valid
Shenyang,PM2.5,1/29/2017 13:00,2017,1,29,13,35,g/m,1 Hr,Valid
Shenyang,PM2.5,1/29/2017 14:00,2017,1,29,14,24,g/m,1 Hr,Valid
Shenyang,PM2.5,1/29/2017 15:00,2017,1,29,15,19,g/m,1 Hr,Valid
Shenyang,PM2.5,1/29/2017 16:00,2017,1,29,16,15,g/m,1 Hr,Valid
Shenyang,PM2.5,1/29/2017 17:00,2017,1,29,17,25,g/m,1 Hr,Valid
Shenyang,PM2.5,1/29/2017 18:00,2017,1,29,18,21,g/m,1 Hr,Valid
Shenyang,PM2.5,1/29/2017 19:00,2017,1,29,19,22,g/m,1 Hr,Valid
Shenyang,PM2.5,1/29/2017 20:00,2017,1,29,20,28,g/m,1 Hr,Valid
Shenyang,PM2.5,1/29/2017 21:00,2017,1,29,21,21,g/m,1 Hr,Valid
Shenyang,PM2.5,1/29/2017 22:00,2017,1,29,22,24,g/m,1 Hr,Valid
Shenyang,PM2.5,1/29/2017 23:00,2017,1,29,23,24,g/m,1 Hr,Valid
Shenyang,PM2.5,1/30/2017 0:00,2017,1,30,0,33,g/m,1 Hr,Valid
Shenyang,PM2.5,1/30/2017 1:00,2017,1,30,1,39,g/m,1 Hr,Valid
Shenyang,PM2.5,1/30/2017 2:00,2017,1,30,2,26,g/m,1 Hr,Valid
Shenyang,PM2.5,1/30/2017 3:00,2017,1,30,3,38,g/m,1 Hr,Valid
Shenyang,PM2.5,1/30/2017 4:00,2017,1,30,4,26,g/m,1 Hr,Valid
Shenyang,PM2.5,1/30/2017 5:00,2017,1,30,5,16,g/m,1 Hr,Valid
Shenyang,PM2.5,1/30/2017 6:00,2017,1,30,6,22,g/m,1 Hr,Valid
Shenyang,PM2.5,1/30/2017 7:00,2017,1,30,7,18,g/m,1 Hr,Valid
Shenyang,PM2.5,1/30/2017 8:00,2017,1,30,8,26,g/m,1 Hr,Valid
Shenyang,PM2.5,1/30/2017 9:00,2017,1,30,9,26,g/m,1 Hr,Valid
Shenyang,PM2.5,1/30/2017 10:00,2017,1,30,10,18,g/m,1 Hr,Valid
Shenyang,PM2.5,1/30/2017 11:00,2017,1,30,11,31,g/m,1 Hr,Valid
Shenyang,PM2.5,1/30/2017 12:00,2017,1,30,12,33,g/m,1 Hr,Valid
Shenyang,PM2.5,1/30/2017 13:00,2017,1,30,13,34,g/m,1 Hr,Valid
Shenyang,PM2.5,1/30/2017 14:00,2017,1,30,14,34,g/m,1 Hr,Valid
Shenyang,PM2.5,1/30/2017 15:00,2017,1,30,15,40,g/m,1 Hr,Valid
Shenyang,PM2.5,1/30/2017 16:00,2017,1,30,16,41,g/m,1 Hr,Valid
Shenyang,PM2.5,1/30/2017 17:00,2017,1,30,17,33,g/m,1 Hr,Valid
Shenyang,PM2.5,1/30/2017 18:00,2017,1,30,18,38,g/m,1 Hr,Valid
Shenyang,PM2.5,1/30/2017 19:00,2017,1,30,19,42,g/m,1 Hr,Valid
Shenyang,PM2.5,1/30/2017 20:00,2017,1,30,20,41,g/m,1 Hr,Valid
Shenyang,PM2.5,1/30/2017 21:00,2017,1,30,21,45,g/m,1 Hr,Valid
Shenyang,PM2.5,1/30/2017 22:00,2017,1,30,22,28,g/m,1 Hr,Valid
Shenyang,PM2.5,1/30/2017 23:00,2017,1,30,23,38,g/m,1 Hr,Valid
Shenyang,PM2.5,1/31/2017 0:00,2017,1,31,0,42,g/m,1 Hr,Valid
Shenyang,PM2.5,1/31/2017 1:00,2017,1,31,1,55,g/m,1 Hr,Valid
Shenyang,PM2.5,1/31/2017 2:00,2017,1,31,2,66,g/m,1 Hr,Valid
Shenyang,PM2.5,1/31/2017 3:00,2017,1,31,3,102,g/m,1 Hr,Valid
Shenyang,PM2.5,1/31/2017 4:00,2017,1,31,4,100,g/m,1 Hr,Valid
Shenyang,PM2.5,1/31/2017 5:00,2017,1,31,5,102,g/m,1 Hr,Valid
Shenyang,PM2.5,1/31/2017 6:00,2017,1,31,6,115,g/m,1 Hr,Valid
Shenyang,PM2.5,1/31/2017 7:00,2017,1,31,7,123,g/m,1 Hr,Valid
Shenyang,PM2.5,1/31/2017 8:00,2017,1,31,8,117,g/m,1 Hr,Valid
Shenyang,PM2.5,1/31/2017 9:00,2017,1,31,9,143,g/m,1 Hr,Valid
Shenyang,PM2.5,1/31/2017 10:00,2017,1,31,10,146,g/m,1 Hr,Valid
Shenyang,PM2.5,1/31/2017 11:00,2017,1,31,11,169,g/m,1 Hr,Valid
Shenyang,PM2.5,1/31/2017 12:00,2017,1,31,12,112,g/m,1 Hr,Valid
Shenyang,PM2.5,1/31/2017 13:00,2017,1,31,13,72,g/m,1 Hr,Valid
Shenyang,PM2.5,1/31/2017 14:00,2017,1,31,14,47,g/m,1 Hr,Valid
Shenyang,PM2.5,1/31/2017 15:00,2017,1,31,15,44,g/m,1 Hr,Valid
Shenyang,PM2.5,1/31/2017 16:00,2017,1,31,16,47,g/m,1 Hr,Valid
Shenyang,PM2.5,1/31/2017 17:00,2017,1,31,17,42,g/m,1 Hr,Valid
Shenyang,PM2.5,1/31/2017 18:00,2017,1,31,18,34,g/m,1 Hr,Valid
Shenyang,PM2.5,1/31/2017 19:00,2017,1,31,19,52,g/m,1 Hr,Valid
Shenyang,PM2.5,1/31/2017 20:00,2017,1,31,20,54,g/m,1 Hr,Valid
Shenyang,PM2.5,1/31/2017 21:00,2017,1,31,21,56,g/m,1 Hr,Valid
Shenyang,PM2.5,1/31/2017 22:00,2017,1,31,22,32,g/m,1 Hr,Valid
Shenyang,PM2.5,1/31/2017 23:00,2017,1,31,23,38,g/m,1 Hr,Valid
Shenyang,PM2.5,2/1/2017 0:00,2017,2,1,0,8,g/m,1 Hr,Valid
Shenyang,PM2.5,2/1/2017 1:00,2017,2,1,1,10,g/m,1 Hr,Valid
Shenyang,PM2.5,2/1/2017 2:00,2017,2,1,2,13,g/m,1 Hr,Valid
Shenyang,PM2.5,2/1/2017 3:00,2017,2,1,3,8,g/m,1 Hr,Valid
Shenyang,PM2.5,2/1/2017 4:00,2017,2,1,4,9,g/m,1 Hr,Valid
Shenyang,PM2.5,2/1/2017 5:00,2017,2,1,5,16,g/m,1 Hr,Valid
Shenyang,PM2.5,2/1/2017 6:00,2017,2,1,6,17,g/m,1 Hr,Valid
Shenyang,PM2.5,2/1/2017 7:00,2017,2,1,7,26,g/m,1 Hr,Valid
Shenyang,PM2.5,2/1/2017 8:00,2017,2,1,8,21,g/m,1 Hr,Valid
Shenyang,PM2.5,2/1/2017 9:00,2017,2,1,9,25,g/m,1 Hr,Valid
Shenyang,PM2.5,2/1/2017 10:00,2017,2,1,10,33,g/m,1 Hr,Valid
Shenyang,PM2.5,2/1/2017 11:00,2017,2,1,11,32,g/m,1 Hr,Valid
Shenyang,PM2.5,2/1/2017 12:00,2017,2,1,12,15,g/m,1 Hr,Valid
Shenyang,PM2.5,2/1/2017 13:00,2017,2,1,13,13,g/m,1 Hr,Valid
Shenyang,PM2.5,2/1/2017 14:00,2017,2,1,14,17,g/m,1 Hr,Valid
Shenyang,PM2.5,2/1/2017 15:00,2017,2,1,15,7,g/m,1 Hr,Valid
Shenyang,PM2.5,2/1/2017 16:00,2017,2,1,16,18,g/m,1 Hr,Valid
Shenyang,PM2.5,2/1/2017 17:00,2017,2,1,17,34,g/m,1 Hr,Valid
Shenyang,PM2.5,2/1/2017 18:00,2017,2,1,18,35,g/m,1 Hr,Valid
Shenyang,PM2.5,2/1/2017 19:00,2017,2,1,19,40,g/m,1 Hr,Valid
Shenyang,PM2.5,2/1/2017 20:00,2017,2,1,20,50,g/m,1 Hr,Valid
Shenyang,PM2.5,2/1/2017 21:00,2017,2,1,21,53,g/m,1 Hr,Valid
Shenyang,PM2.5,2/1/2017 22:00,2017,2,1,22,57,g/m,1 Hr,Valid
Shenyang,PM2.5,2/1/2017 23:00,2017,2,1,23,63,g/m,1 Hr,Valid
Shenyang,PM2.5,2/2/2017 0:00,2017,2,2,0,74,g/m,1 Hr,Valid
Shenyang,PM2.5,2/2/2017 1:00,2017,2,2,1,69,g/m,1 Hr,Valid
Shenyang,PM2.5,2/2/2017 2:00,2017,2,2,2,54,g/m,1 Hr,Valid
Shenyang,PM2.5,2/2/2017 3:00,2017,2,2,3,48,g/m,1 Hr,Valid
Shenyang,PM2.5,2/2/2017 4:00,2017,2,2,4,71,g/m,1 Hr,Valid
Shenyang,PM2.5,2/2/2017 5:00,2017,2,2,5,54,g/m,1 Hr,Valid
Shenyang,PM2.5,2/2/2017 6:00,2017,2,2,6,60,g/m,1 Hr,Valid
Shenyang,PM2.5,2/2/2017 7:00,2017,2,2,7,74,g/m,1 Hr,Valid
Shenyang,PM2.5,2/2/2017 8:00,2017,2,2,8,77,g/m,1 Hr,Valid
Shenyang,PM2.5,2/2/2017 9:00,2017,2,2,9,91,g/m,1 Hr,Valid
Shenyang,PM2.5,2/2/2017 10:00,2017,2,2,10,113,g/m,1 Hr,Valid
Shenyang,PM2.5,2/2/2017 11:00,2017,2,2,11,116,g/m,1 Hr,Valid
Shenyang,PM2.5,2/2/2017 12:00,2017,2,2,12,94,g/m,1 Hr,Valid
Shenyang,PM2.5,2/2/2017 13:00,2017,2,2,13,74,g/m,1 Hr,Valid
Shenyang,PM2.5,2/2/2017 14:00,2017,2,2,14,55,g/m,1 Hr,Valid
Shenyang,PM2.5,2/2/2017 15:00,2017,2,2,15,43,g/m,1 Hr,Valid
Shenyang,PM2.5,2/2/2017 16:00,2017,2,2,16,48,g/m,1 Hr,Valid
Shenyang,PM2.5,2/2/2017 17:00,2017,2,2,17,59,g/m,1 Hr,Valid
Shenyang,PM2.5,2/2/2017 18:00,2017,2,2,18,80,g/m,1 Hr,Valid
Shenyang,PM2.5,2/2/2017 19:00,2017,2,2,19,78,g/m,1 Hr,Valid
Shenyang,PM2.5,2/2/2017 20:00,2017,2,2,20,89,g/m,1 Hr,Valid
Shenyang,PM2.5,2/2/2017 21:00,2017,2,2,21,113,g/m,1 Hr,Valid
Shenyang,PM2.5,2/2/2017 22:00,2017,2,2,22,140,g/m,1 Hr,Valid
Shenyang,PM2.5,2/2/2017 23:00,2017,2,2,23,138,g/m,1 Hr,Valid
Shenyang,PM2.5,2/3/2017 0:00,2017,2,3,0,145,g/m,1 Hr,Valid
Shenyang,PM2.5,2/3/2017 1:00,2017,2,3,1,141,g/m,1 Hr,Valid
Shenyang,PM2.5,2/3/2017 2:00,2017,2,3,2,140,g/m,1 Hr,Valid
Shenyang,PM2.5,2/3/2017 3:00,2017,2,3,3,120,g/m,1 Hr,Valid
Shenyang,PM2.5,2/3/2017 4:00,2017,2,3,4,126,g/m,1 Hr,Valid
Shenyang,PM2.5,2/3/2017 5:00,2017,2,3,5,138,g/m,1 Hr,Valid
Shenyang,PM2.5,2/3/2017 6:00,2017,2,3,6,149,g/m,1 Hr,Valid
Shenyang,PM2.5,2/3/2017 7:00,2017,2,3,7,144,g/m,1 Hr,Valid
Shenyang,PM2.5,2/3/2017 8:00,2017,2,3,8,166,g/m,1 Hr,Valid
Shenyang,PM2.5,2/3/2017 9:00,2017,2,3,9,154,g/m,1 Hr,Valid
Shenyang,PM2.5,2/3/2017 10:00,2017,2,3,10,194,g/m,1 Hr,Valid
Shenyang,PM2.5,2/3/2017 11:00,2017,2,3,11,201,g/m,1 Hr,Valid
Shenyang,PM2.5,2/3/2017 12:00,2017,2,3,12,175,g/m,1 Hr,Valid
Shenyang,PM2.5,2/3/2017 13:00,2017,2,3,13,126,g/m,1 Hr,Valid
Shenyang,PM2.5,2/3/2017 14:00,2017,2,3,14,108,g/m,1 Hr,Valid
Shenyang,PM2.5,2/3/2017 15:00,2017,2,3,15,119,g/m,1 Hr,Valid
Shenyang,PM2.5,2/3/2017 16:00,2017,2,3,16,105,g/m,1 Hr,Valid
Shenyang,PM2.5,2/3/2017 17:00,2017,2,3,17,151,g/m,1 Hr,Valid
Shenyang,PM2.5,2/3/2017 18:00,2017,2,3,18,155,g/m,1 Hr,Valid
Shenyang,PM2.5,2/3/2017 19:00,2017,2,3,19,122,g/m,1 Hr,Valid
Shenyang,PM2.5,2/3/2017 20:00,2017,2,3,20,113,g/m,1 Hr,Valid
Shenyang,PM2.5,2/3/2017 21:00,2017,2,3,21,106,g/m,1 Hr,Valid
Shenyang,PM2.5,2/3/2017 22:00,2017,2,3,22,95,g/m,1 Hr,Valid
Shenyang,PM2.5,2/3/2017 23:00,2017,2,3,23,95,g/m,1 Hr,Valid
Shenyang,PM2.5,2/4/2017 0:00,2017,2,4,0,90,g/m,1 Hr,Valid
Shenyang,PM2.5,2/4/2017 1:00,2017,2,4,1,103,g/m,1 Hr,Valid
Shenyang,PM2.5,2/4/2017 2:00,2017,2,4,2,100,g/m,1 Hr,Valid
Shenyang,PM2.5,2/4/2017 3:00,2017,2,4,3,102,g/m,1 Hr,Valid
Shenyang,PM2.5,2/4/2017 4:00,2017,2,4,4,115,g/m,1 Hr,Valid
Shenyang,PM2.5,2/4/2017 5:00,2017,2,4,5,124,g/m,1 Hr,Valid
Shenyang,PM2.5,2/4/2017 6:00,2017,2,4,6,120,g/m,1 Hr,Valid
Shenyang,PM2.5,2/4/2017 7:00,2017,2,4,7,122,g/m,1 Hr,Valid
Shenyang,PM2.5,2/4/2017 8:00,2017,2,4,8,140,g/m,1 Hr,Valid
Shenyang,PM2.5,2/4/2017 9:00,2017,2,4,9,150,g/m,1 Hr,Valid
Shenyang,PM2.5,2/4/2017 10:00,2017,2,4,10,192,g/m,1 Hr,Valid
Shenyang,PM2.5,2/4/2017 11:00,2017,2,4,11,164,g/m,1 Hr,Valid
Shenyang,PM2.5,2/4/2017 12:00,2017,2,4,12,153,g/m,1 Hr,Valid
Shenyang,PM2.5,2/4/2017 13:00,2017,2,4,13,149,g/m,1 Hr,Valid
Shenyang,PM2.5,2/4/2017 14:00,2017,2,4,14,145,g/m,1 Hr,Valid
Shenyang,PM2.5,2/4/2017 15:00,2017,2,4,15,162,g/m,1 Hr,Valid
Shenyang,PM2.5,2/4/2017 16:00,2017,2,4,16,146,g/m,1 Hr,Valid
Shenyang,PM2.5,2/4/2017 17:00,2017,2,4,17,160,g/m,1 Hr,Valid
Shenyang,PM2.5,2/4/2017 18:00,2017,2,4,18,211,g/m,1 Hr,Valid
Shenyang,PM2.5,2/4/2017 19:00,2017,2,4,19,198,g/m,1 Hr,Valid
Shenyang,PM2.5,2/4/2017 20:00,2017,2,4,20,197,g/m,1 Hr,Valid
Shenyang,PM2.5,2/4/2017 21:00,2017,2,4,21,212,g/m,1 Hr,Valid
Shenyang,PM2.5,2/4/2017 22:00,2017,2,4,22,229,g/m,1 Hr,Valid
Shenyang,PM2.5,2/4/2017 23:00,2017,2,4,23,229,g/m,1 Hr,Valid
Shenyang,PM2.5,2/5/2017 0:00,2017,2,5,0,230,g/m,1 Hr,Valid
Shenyang,PM2.5,2/5/2017 1:00,2017,2,5,1,235,g/m,1 Hr,Valid
Shenyang,PM2.5,2/5/2017 2:00,2017,2,5,2,233,g/m,1 Hr,Valid
Shenyang,PM2.5,2/5/2017 3:00,2017,2,5,3,218,g/m,1 Hr,Valid
Shenyang,PM2.5,2/5/2017 4:00,2017,2,5,4,197,g/m,1 Hr,Valid
Shenyang,PM2.5,2/5/2017 5:00,2017,2,5,5,124,g/m,1 Hr,Valid
Shenyang,PM2.5,2/5/2017 6:00,2017,2,5,6,106,g/m,1 Hr,Valid
Shenyang,PM2.5,2/5/2017 7:00,2017,2,5,7,73,g/m,1 Hr,Valid
Shenyang,PM2.5,2/5/2017 8:00,2017,2,5,8,88,g/m,1 Hr,Valid
Shenyang,PM2.5,2/5/2017 9:00,2017,2,5,9,87,g/m,1 Hr,Valid
Shenyang,PM2.5,2/5/2017 10:00,2017,2,5,10,103,g/m,1 Hr,Valid
Shenyang,PM2.5,2/5/2017 11:00,2017,2,5,11,87,g/m,1 Hr,Valid
Shenyang,PM2.5,2/5/2017 12:00,2017,2,5,12,64,g/m,1 Hr,Valid
Shenyang,PM2.5,2/5/2017 13:00,2017,2,5,13,48,g/m,1 Hr,Valid
Shenyang,PM2.5,2/5/2017 14:00,2017,2,5,14,35,g/m,1 Hr,Valid
Shenyang,PM2.5,2/5/2017 15:00,2017,2,5,15,37,g/m,1 Hr,Valid
Shenyang,PM2.5,2/5/2017 16:00,2017,2,5,16,24,g/m,1 Hr,Valid
Shenyang,PM2.5,2/5/2017 17:00,2017,2,5,17,31,g/m,1 Hr,Valid
Shenyang,PM2.5,2/5/2017 18:00,2017,2,5,18,25,g/m,1 Hr,Valid
Shenyang,PM2.5,2/5/2017 19:00,2017,2,5,19,22,g/m,1 Hr,Valid
Shenyang,PM2.5,2/5/2017 20:00,2017,2,5,20,26,g/m,1 Hr,Valid
Shenyang,PM2.5,2/5/2017 21:00,2017,2,5,21,20,g/m,1 Hr,Valid
Shenyang,PM2.5,2/5/2017 22:00,2017,2,5,22,32,g/m,1 Hr,Valid
Shenyang,PM2.5,2/5/2017 23:00,2017,2,5,23,15,g/m,1 Hr,Valid
Shenyang,PM2.5,2/6/2017 0:00,2017,2,6,0,13,g/m,1 Hr,Valid
Shenyang,PM2.5,2/6/2017 1:00,2017,2,6,1,23,g/m,1 Hr,Valid
Shenyang,PM2.5,2/6/2017 2:00,2017,2,6,2,21,g/m,1 Hr,Valid
Shenyang,PM2.5,2/6/2017 3:00,2017,2,6,3,21,g/m,1 Hr,Valid
Shenyang,PM2.5,2/6/2017 4:00,2017,2,6,4,15,g/m,1 Hr,Valid
Shenyang,PM2.5,2/6/2017 5:00,2017,2,6,5,22,g/m,1 Hr,Valid
Shenyang,PM2.5,2/6/2017 6:00,2017,2,6,6,22,g/m,1 Hr,Valid
Shenyang,PM2.5,2/6/2017 7:00,2017,2,6,7,19,g/m,1 Hr,Valid
Shenyang,PM2.5,2/6/2017 8:00,2017,2,6,8,21,g/m,1 Hr,Valid
Shenyang,PM2.5,2/6/2017 9:00,2017,2,6,9,42,g/m,1 Hr,Valid
Shenyang,PM2.5,2/6/2017 10:00,2017,2,6,10,30,g/m,1 Hr,Valid
Shenyang,PM2.5,2/6/2017 11:00,2017,2,6,11,37,g/m,1 Hr,Valid
Shenyang,PM2.5,2/6/2017 12:00,2017,2,6,12,27,g/m,1 Hr,Valid
Shenyang,PM2.5,2/6/2017 13:00,2017,2,6,13,22,g/m,1 Hr,Valid
Shenyang,PM2.5,2/6/2017 14:00,2017,2,6,14,8,g/m,1 Hr,Valid
Shenyang,PM2.5,2/6/2017 15:00,2017,2,6,15,16,g/m,1 Hr,Valid
Shenyang,PM2.5,2/6/2017 16:00,2017,2,6,16,23,g/m,1 Hr,Valid
Shenyang,PM2.5,2/6/2017 17:00,2017,2,6,17,27,g/m,1 Hr,Valid
Shenyang,PM2.5,2/6/2017 18:00,2017,2,6,18,26,g/m,1 Hr,Valid
Shenyang,PM2.5,2/6/2017 19:00,2017,2,6,19,38,g/m,1 Hr,Valid
Shenyang,PM2.5,2/6/2017 20:00,2017,2,6,20,46,g/m,1 Hr,Valid
Shenyang,PM2.5,2/6/2017 21:00,2017,2,6,21,45,g/m,1 Hr,Valid
Shenyang,PM2.5,2/6/2017 22:00,2017,2,6,22,37,g/m,1 Hr,Valid
Shenyang,PM2.5,2/6/2017 23:00,2017,2,6,23,54,g/m,1 Hr,Valid
Shenyang,PM2.5,2/7/2017 0:00,2017,2,7,0,48,g/m,1 Hr,Valid
Shenyang,PM2.5,2/7/2017 1:00,2017,2,7,1,36,g/m,1 Hr,Valid
Shenyang,PM2.5,2/7/2017 2:00,2017,2,7,2,76,g/m,1 Hr,Valid
Shenyang,PM2.5,2/7/2017 3:00,2017,2,7,3,83,g/m,1 Hr,Valid
Shenyang,PM2.5,2/7/2017 4:00,2017,2,7,4,132,g/m,1 Hr,Valid
Shenyang,PM2.5,2/7/2017 5:00,2017,2,7,5,133,g/m,1 Hr,Valid
Shenyang,PM2.5,2/7/2017 6:00,2017,2,7,6,137,g/m,1 Hr,Valid
Shenyang,PM2.5,2/7/2017 7:00,2017,2,7,7,133,g/m,1 Hr,Valid
Shenyang,PM2.5,2/7/2017 8:00,2017,2,7,8,147,g/m,1 Hr,Valid
Shenyang,PM2.5,2/7/2017 9:00,2017,2,7,9,152,g/m,1 Hr,Valid
Shenyang,PM2.5,2/7/2017 10:00,2017,2,7,10,156,g/m,1 Hr,Valid
Shenyang,PM2.5,2/7/2017 11:00,2017,2,7,11,179,g/m,1 Hr,Valid
Shenyang,PM2.5,2/7/2017 12:00,2017,2,7,12,145,g/m,1 Hr,Valid
Shenyang,PM2.5,2/7/2017 13:00,2017,2,7,13,116,g/m,1 Hr,Valid
Shenyang,PM2.5,2/7/2017 14:00,2017,2,7,14,134,g/m,1 Hr,Valid
Shenyang,PM2.5,2/7/2017 15:00,2017,2,7,15,222,g/m,1 Hr,Valid
Shenyang,PM2.5,2/7/2017 16:00,2017,2,7,16,212,g/m,1 Hr,Valid
Shenyang,PM2.5,2/7/2017 17:00,2017,2,7,17,177,g/m,1 Hr,Valid
Shenyang,PM2.5,2/7/2017 18:00,2017,2,7,18,126,g/m,1 Hr,Valid
Shenyang,PM2.5,2/7/2017 19:00,2017,2,7,19,107,g/m,1 Hr,Valid
Shenyang,PM2.5,2/7/2017 20:00,2017,2,7,20,86,g/m,1 Hr,Valid
Shenyang,PM2.5,2/7/2017 21:00,2017,2,7,21,76,g/m,1 Hr,Valid
Shenyang,PM2.5,2/7/2017 22:00,2017,2,7,22,68,g/m,1 Hr,Valid
Shenyang,PM2.5,2/7/2017 23:00,2017,2,7,23,63,g/m,1 Hr,Valid
Shenyang,PM2.5,2/8/2017 0:00,2017,2,8,0,58,g/m,1 Hr,Valid
Shenyang,PM2.5,2/8/2017 1:00,2017,2,8,1,51,g/m,1 Hr,Valid
Shenyang,PM2.5,2/8/2017 2:00,2017,2,8,2,69,g/m,1 Hr,Valid
Shenyang,PM2.5,2/8/2017 3:00,2017,2,8,3,57,g/m,1 Hr,Valid
Shenyang,PM2.5,2/8/2017 4:00,2017,2,8,4,63,g/m,1 Hr,Valid
Shenyang,PM2.5,2/8/2017 5:00,2017,2,8,5,47,g/m,1 Hr,Valid
Shenyang,PM2.5,2/8/2017 6:00,2017,2,8,6,53,g/m,1 Hr,Valid
Shenyang,PM2.5,2/8/2017 7:00,2017,2,8,7,58,g/m,1 Hr,Valid
Shenyang,PM2.5,2/8/2017 8:00,2017,2,8,8,43,g/m,1 Hr,Valid
Shenyang,PM2.5,2/8/2017 9:00,2017,2,8,9,29,g/m,1 Hr,Valid
Shenyang,PM2.5,2/8/2017 10:00,2017,2,8,10,36,g/m,1 Hr,Valid
Shenyang,PM2.5,2/8/2017 11:00,2017,2,8,11,20,g/m,1 Hr,Valid
Shenyang,PM2.5,2/8/2017 12:00,2017,2,8,12,17,g/m,1 Hr,Valid
Shenyang,PM2.5,2/8/2017 13:00,2017,2,8,13,20,g/m,1 Hr,Valid
Shenyang,PM2.5,2/8/2017 14:00,2017,2,8,14,9,g/m,1 Hr,Valid
Shenyang,PM2.5,2/8/2017 15:00,2017,2,8,15,16,g/m,1 Hr,Valid
Shenyang,PM2.5,2/8/2017 16:00,2017,2,8,16,22,g/m,1 Hr,Valid
Shenyang,PM2.5,2/8/2017 17:00,2017,2,8,17,16,g/m,1 Hr,Valid
Shenyang,PM2.5,2/8/2017 18:00,2017,2,8,18,29,g/m,1 Hr,Valid
Shenyang,PM2.5,2/8/2017 19:00,2017,2,8,19,32,g/m,1 Hr,Valid
Shenyang,PM2.5,2/8/2017 20:00,2017,2,8,20,34,g/m,1 Hr,Valid
Shenyang,PM2.5,2/8/2017 21:00,2017,2,8,21,25,g/m,1 Hr,Valid
Shenyang,PM2.5,2/8/2017 22:00,2017,2,8,22,15,g/m,1 Hr,Valid
Shenyang,PM2.5,2/8/2017 23:00,2017,2,8,23,24,g/m,1 Hr,Valid
Shenyang,PM2.5,2/9/2017 0:00,2017,2,9,0,19,g/m,1 Hr,Valid
Shenyang,PM2.5,2/9/2017 1:00,2017,2,9,1,10,g/m,1 Hr,Valid
Shenyang,PM2.5,2/9/2017 2:00,2017,2,9,2,17,g/m,1 Hr,Valid
Shenyang,PM2.5,2/9/2017 3:00,2017,2,9,3,9,g/m,1 Hr,Valid
Shenyang,PM2.5,2/9/2017 4:00,2017,2,9,4,9,g/m,1 Hr,Valid
Shenyang,PM2.5,2/9/2017 5:00,2017,2,9,5,16,g/m,1 Hr,Valid
Shenyang,PM2.5,2/9/2017 6:00,2017,2,9,6,20,g/m,1 Hr,Valid
Shenyang,PM2.5,2/9/2017 7:00,2017,2,9,7,25,g/m,1 Hr,Valid
Shenyang,PM2.5,2/9/2017 8:00,2017,2,9,8,19,g/m,1 Hr,Valid
Shenyang,PM2.5,2/9/2017 9:00,2017,2,9,9,20,g/m,1 Hr,Valid
Shenyang,PM2.5,2/9/2017 10:00,2017,2,9,10,26,g/m,1 Hr,Valid
Shenyang,PM2.5,2/9/2017 11:00,2017,2,9,11,51,g/m,1 Hr,Valid
Shenyang,PM2.5,2/9/2017 12:00,2017,2,9,12,22,g/m,1 Hr,Valid
Shenyang,PM2.5,2/9/2017 13:00,2017,2,9,13,28,g/m,1 Hr,Valid
Shenyang,PM2.5,2/9/2017 14:00,2017,2,9,14,20,g/m,1 Hr,Valid
Shenyang,PM2.5,2/9/2017 15:00,2017,2,9,15,26,g/m,1 Hr,Valid
Shenyang,PM2.5,2/9/2017 16:00,2017,2,9,16,19,g/m,1 Hr,Valid
Shenyang,PM2.5,2/9/2017 17:00,2017,2,9,17,28,g/m,1 Hr,Valid
Shenyang,PM2.5,2/9/2017 18:00,2017,2,9,18,21,g/m,1 Hr,Valid
Shenyang,PM2.5,2/9/2017 19:00,2017,2,9,19,23,g/m,1 Hr,Valid
Shenyang,PM2.5,2/9/2017 20:00,2017,2,9,20,24,g/m,1 Hr,Valid
Shenyang,PM2.5,2/9/2017 21:00,2017,2,9,21,32,g/m,1 Hr,Valid
Shenyang,PM2.5,2/9/2017 22:00,2017,2,9,22,29,g/m,1 Hr,Valid
Shenyang,PM2.5,2/9/2017 23:00,2017,2,9,23,35,g/m,1 Hr,Valid
Shenyang,PM2.5,2/10/2017 0:00,2017,2,10,0,27,g/m,1 Hr,Valid
Shenyang,PM2.5,2/10/2017 1:00,2017,2,10,1,27,g/m,1 Hr,Valid
Shenyang,PM2.5,2/10/2017 2:00,2017,2,10,2,35,g/m,1 Hr,Valid
Shenyang,PM2.5,2/10/2017 3:00,2017,2,10,3,37,g/m,1 Hr,Valid
Shenyang,PM2.5,2/10/2017 4:00,2017,2,10,4,26,g/m,1 Hr,Valid
Shenyang,PM2.5,2/10/2017 5:00,2017,2,10,5,29,g/m,1 Hr,Valid
Shenyang,PM2.5,2/10/2017 6:00,2017,2,10,6,22,g/m,1 Hr,Valid
Shenyang,PM2.5,2/10/2017 7:00,2017,2,10,7,23,g/m,1 Hr,Valid
Shenyang,PM2.5,2/10/2017 8:00,2017,2,10,8,25,g/m,1 Hr,Valid
Shenyang,PM2.5,2/10/2017 9:00,2017,2,10,9,21,g/m,1 Hr,Valid
Shenyang,PM2.5,2/10/2017 10:00,2017,2,10,10,29,g/m,1 Hr,Valid
Shenyang,PM2.5,2/10/2017 11:00,2017,2,10,11,35,g/m,1 Hr,Valid
Shenyang,PM2.5,2/10/2017 12:00,2017,2,10,12,23,g/m,1 Hr,Valid
Shenyang,PM2.5,2/10/2017 13:00,2017,2,10,13,25,g/m,1 Hr,Valid
Shenyang,PM2.5,2/10/2017 14:00,2017,2,10,14,13,g/m,1 Hr,Valid
Shenyang,PM2.5,2/10/2017 15:00,2017,2,10,15,23,g/m,1 Hr,Valid
Shenyang,PM2.5,2/10/2017 16:00,2017,2,10,16,17,g/m,1 Hr,Valid
Shenyang,PM2.5,2/10/2017 17:00,2017,2,10,17,30,g/m,1 Hr,Valid
Shenyang,PM2.5,2/10/2017 18:00,2017,2,10,18,21,g/m,1 Hr,Valid
Shenyang,PM2.5,2/10/2017 19:00,2017,2,10,19,37,g/m,1 Hr,Valid
Shenyang,PM2.5,2/10/2017 20:00,2017,2,10,20,39,g/m,1 Hr,Valid
Shenyang,PM2.5,2/10/2017 21:00,2017,2,10,21,51,g/m,1 Hr,Valid
Shenyang,PM2.5,2/10/2017 22:00,2017,2,10,22,49,g/m,1 Hr,Valid
Shenyang,PM2.5,2/10/2017 23:00,2017,2,10,23,37,g/m,1 Hr,Valid
Shenyang,PM2.5,2/11/2017 0:00,2017,2,11,0,47,g/m,1 Hr,Valid
Shenyang,PM2.5,2/11/2017 1:00,2017,2,11,1,39,g/m,1 Hr,Valid
Shenyang,PM2.5,2/11/2017 2:00,2017,2,11,2,31,g/m,1 Hr,Valid
Shenyang,PM2.5,2/11/2017 3:00,2017,2,11,3,24,g/m,1 Hr,Valid
Shenyang,PM2.5,2/11/2017 4:00,2017,2,11,4,27,g/m,1 Hr,Valid
Shenyang,PM2.5,2/11/2017 5:00,2017,2,11,5,25,g/m,1 Hr,Valid
Shenyang,PM2.5,2/11/2017 6:00,2017,2,11,6,21,g/m,1 Hr,Valid
Shenyang,PM2.5,2/11/2017 7:00,2017,2,11,7,22,g/m,1 Hr,Valid
Shenyang,PM2.5,2/11/2017 8:00,2017,2,11,8,33,g/m,1 Hr,Valid
Shenyang,PM2.5,2/11/2017 9:00,2017,2,11,9,28,g/m,1 Hr,Valid
Shenyang,PM2.5,2/11/2017 10:00,2017,2,11,10,33,g/m,1 Hr,Valid
Shenyang,PM2.5,2/11/2017 11:00,2017,2,11,11,51,g/m,1 Hr,Valid
Shenyang,PM2.5,2/11/2017 12:00,2017,2,11,12,48,g/m,1 Hr,Valid
Shenyang,PM2.5,2/11/2017 13:00,2017,2,11,13,49,g/m,1 Hr,Valid
Shenyang,PM2.5,2/11/2017 14:00,2017,2,11,14,35,g/m,1 Hr,Valid
Shenyang,PM2.5,2/11/2017 15:00,2017,2,11,15,45,g/m,1 Hr,Valid
Shenyang,PM2.5,2/11/2017 16:00,2017,2,11,16,56,g/m,1 Hr,Valid
Shenyang,PM2.5,2/11/2017 17:00,2017,2,11,17,59,g/m,1 Hr,Valid
Shenyang,PM2.5,2/11/2017 18:00,2017,2,11,18,89,g/m,1 Hr,Valid
Shenyang,PM2.5,2/11/2017 19:00,2017,2,11,19,132,g/m,1 Hr,Valid
Shenyang,PM2.5,2/11/2017 20:00,2017,2,11,20,168,g/m,1 Hr,Valid
Shenyang,PM2.5,2/11/2017 21:00,2017,2,11,21,303,g/m,1 Hr,Valid
Shenyang,PM2.5,2/11/2017 22:00,2017,2,11,22,258,g/m,1 Hr,Valid
Shenyang,PM2.5,2/11/2017 23:00,2017,2,11,23,226,g/m,1 Hr,Valid
Shenyang,PM2.5,2/12/2017 0:00,2017,2,12,0,219,g/m,1 Hr,Valid
Shenyang,PM2.5,2/12/2017 1:00,2017,2,12,1,239,g/m,1 Hr,Valid
Shenyang,PM2.5,2/12/2017 2:00,2017,2,12,2,187,g/m,1 Hr,Valid
Shenyang,PM2.5,2/12/2017 3:00,2017,2,12,3,168,g/m,1 Hr,Valid
Shenyang,PM2.5,2/12/2017 4:00,2017,2,12,4,195,g/m,1 Hr,Valid
Shenyang,PM2.5,2/12/2017 5:00,2017,2,12,5,135,g/m,1 Hr,Valid
Shenyang,PM2.5,2/12/2017 6:00,2017,2,12,6,159,g/m,1 Hr,Valid
Shenyang,PM2.5,2/12/2017 7:00,2017,2,12,7,178,g/m,1 Hr,Valid
Shenyang,PM2.5,2/12/2017 8:00,2017,2,12,8,185,g/m,1 Hr,Valid
Shenyang,PM2.5,2/12/2017 9:00,2017,2,12,9,153,g/m,1 Hr,Valid
Shenyang,PM2.5,2/12/2017 10:00,2017,2,12,10,107,g/m,1 Hr,Valid
Shenyang,PM2.5,2/12/2017 11:00,2017,2,12,11,110,g/m,1 Hr,Valid
Shenyang,PM2.5,2/12/2017 12:00,2017,2,12,12,83,g/m,1 Hr,Valid
Shenyang,PM2.5,2/12/2017 13:00,2017,2,12,13,59,g/m,1 Hr,Valid
Shenyang,PM2.5,2/12/2017 14:00,2017,2,12,14,62,g/m,1 Hr,Valid
Shenyang,PM2.5,2/12/2017 15:00,2017,2,12,15,62,g/m,1 Hr,Valid
Shenyang,PM2.5,2/12/2017 16:00,2017,2,12,16,68,g/m,1 Hr,Valid
Shenyang,PM2.5,2/12/2017 17:00,2017,2,12,17,67,g/m,1 Hr,Valid
Shenyang,PM2.5,2/12/2017 18:00,2017,2,12,18,86,g/m,1 Hr,Valid
Shenyang,PM2.5,2/12/2017 19:00,2017,2,12,19,107,g/m,1 Hr,Valid
Shenyang,PM2.5,2/12/2017 20:00,2017,2,12,20,135,g/m,1 Hr,Valid
Shenyang,PM2.5,2/12/2017 21:00,2017,2,12,21,164,g/m,1 Hr,Valid
Shenyang,PM2.5,2/12/2017 22:00,2017,2,12,22,182,g/m,1 Hr,Valid
Shenyang,PM2.5,2/12/2017 23:00,2017,2,12,23,167,g/m,1 Hr,Valid
Shenyang,PM2.5,2/13/2017 0:00,2017,2,13,0,187,g/m,1 Hr,Valid
Shenyang,PM2.5,2/13/2017 1:00,2017,2,13,1,172,g/m,1 Hr,Valid
Shenyang,PM2.5,2/13/2017 2:00,2017,2,13,2,165,g/m,1 Hr,Valid
Shenyang,PM2.5,2/13/2017 3:00,2017,2,13,3,162,g/m,1 Hr,Valid
Shenyang,PM2.5,2/13/2017 4:00,2017,2,13,4,185,g/m,1 Hr,Valid
Shenyang,PM2.5,2/13/2017 5:00,2017,2,13,5,189,g/m,1 Hr,Valid
Shenyang,PM2.5,2/13/2017 6:00,2017,2,13,6,158,g/m,1 Hr,Valid
Shenyang,PM2.5,2/13/2017 7:00,2017,2,13,7,209,g/m,1 Hr,Valid
Shenyang,PM2.5,2/13/2017 8:00,2017,2,13,8,230,g/m,1 Hr,Valid
Shenyang,PM2.5,2/13/2017 9:00,2017,2,13,9,238,g/m,1 Hr,Valid
Shenyang,PM2.5,2/13/2017 10:00,2017,2,13,10,254,g/m,1 Hr,Valid
Shenyang,PM2.5,2/13/2017 11:00,2017,2,13,11,112,g/m,1 Hr,Valid
Shenyang,PM2.5,2/13/2017 12:00,2017,2,13,12,48,g/m,1 Hr,Valid
Shenyang,PM2.5,2/13/2017 13:00,2017,2,13,13,39,g/m,1 Hr,Valid
Shenyang,PM2.5,2/13/2017 14:00,2017,2,13,14,29,g/m,1 Hr,Valid
Shenyang,PM2.5,2/13/2017 15:00,2017,2,13,15,49,g/m,1 Hr,Valid
Shenyang,PM2.5,2/13/2017 16:00,2017,2,13,16,54,g/m,1 Hr,Valid
Shenyang,PM2.5,2/13/2017 17:00,2017,2,13,17,73,g/m,1 Hr,Valid
Shenyang,PM2.5,2/13/2017 18:00,2017,2,13,18,67,g/m,1 Hr,Valid
Shenyang,PM2.5,2/13/2017 19:00,2017,2,13,19,69,g/m,1 Hr,Valid
Shenyang,PM2.5,2/13/2017 20:00,2017,2,13,20,89,g/m,1 Hr,Valid
Shenyang,PM2.5,2/13/2017 21:00,2017,2,13,21,73,g/m,1 Hr,Valid
Shenyang,PM2.5,2/13/2017 22:00,2017,2,13,22,73,g/m,1 Hr,Valid
Shenyang,PM2.5,2/13/2017 23:00,2017,2,13,23,78,g/m,1 Hr,Valid
Shenyang,PM2.5,2/14/2017 0:00,2017,2,14,0,68,g/m,1 Hr,Valid
Shenyang,PM2.5,2/14/2017 1:00,2017,2,14,1,104,g/m,1 Hr,Valid
Shenyang,PM2.5,2/14/2017 2:00,2017,2,14,2,102,g/m,1 Hr,Valid
Shenyang,PM2.5,2/14/2017 3:00,2017,2,14,3,114,g/m,1 Hr,Valid
Shenyang,PM2.5,2/14/2017 4:00,2017,2,14,4,116,g/m,1 Hr,Valid
Shenyang,PM2.5,2/14/2017 5:00,2017,2,14,5,171,g/m,1 Hr,Valid
Shenyang,PM2.5,2/14/2017 6:00,2017,2,14,6,154,g/m,1 Hr,Valid
Shenyang,PM2.5,2/14/2017 7:00,2017,2,14,7,201,g/m,1 Hr,Valid
Shenyang,PM2.5,2/14/2017 8:00,2017,2,14,8,220,g/m,1 Hr,Valid
Shenyang,PM2.5,2/14/2017 9:00,2017,2,14,9,227,g/m,1 Hr,Valid
Shenyang,PM2.5,2/14/2017 10:00,2017,2,14,10,223,g/m,1 Hr,Valid
Shenyang,PM2.5,2/14/2017 11:00,2017,2,14,11,129,g/m,1 Hr,Valid
Shenyang,PM2.5,2/14/2017 12:00,2017,2,14,12,97,g/m,1 Hr,Valid
Shenyang,PM2.5,2/14/2017 13:00,2017,2,14,13,49,g/m,1 Hr,Valid
Shenyang,PM2.5,2/14/2017 14:00,2017,2,14,14,64,g/m,1 Hr,Valid
Shenyang,PM2.5,2/14/2017 15:00,2017,2,14,15,66,g/m,1 Hr,Valid
Shenyang,PM2.5,2/14/2017 16:00,2017,2,14,16,70,g/m,1 Hr,Valid
Shenyang,PM2.5,2/14/2017 17:00,2017,2,14,17,47,g/m,1 Hr,Valid
Shenyang,PM2.5,2/14/2017 18:00,2017,2,14,18,42,g/m,1 Hr,Valid
Shenyang,PM2.5,2/14/2017 19:00,2017,2,14,19,54,g/m,1 Hr,Valid
Shenyang,PM2.5,2/14/2017 20:00,2017,2,14,20,78,g/m,1 Hr,Valid
Shenyang,PM2.5,2/14/2017 21:00,2017,2,14,21,244,g/m,1 Hr,Valid
Shenyang,PM2.5,2/14/2017 22:00,2017,2,14,22,133,g/m,1 Hr,Valid
Shenyang,PM2.5,2/14/2017 23:00,2017,2,14,23,113,g/m,1 Hr,Valid
Shenyang,PM2.5,2/15/2017 0:00,2017,2,15,0,70,g/m,1 Hr,Valid
Shenyang,PM2.5,2/15/2017 1:00,2017,2,15,1,48,g/m,1 Hr,Valid
Shenyang,PM2.5,2/15/2017 2:00,2017,2,15,2,45,g/m,1 Hr,Valid
Shenyang,PM2.5,2/15/2017 3:00,2017,2,15,3,51,g/m,1 Hr,Valid
Shenyang,PM2.5,2/15/2017 4:00,2017,2,15,4,51,g/m,1 Hr,Valid
Shenyang,PM2.5,2/15/2017 5:00,2017,2,15,5,56,g/m,1 Hr,Valid
Shenyang,PM2.5,2/15/2017 6:00,2017,2,15,6,60,g/m,1 Hr,Valid
Shenyang,PM2.5,2/15/2017 7:00,2017,2,15,7,67,g/m,1 Hr,Valid
Shenyang,PM2.5,2/15/2017 8:00,2017,2,15,8,74,g/m,1 Hr,Valid
Shenyang,PM2.5,2/15/2017 9:00,2017,2,15,9,79,g/m,1 Hr,Valid
Shenyang,PM2.5,2/15/2017 10:00,2017,2,15,10,101,g/m,1 Hr,Valid
Shenyang,PM2.5,2/15/2017 11:00,2017,2,15,11,98,g/m,1 Hr,Valid
Shenyang,PM2.5,2/15/2017 12:00,2017,2,15,12,105,g/m,1 Hr,Valid
Shenyang,PM2.5,2/15/2017 13:00,2017,2,15,13,104,g/m,1 Hr,Valid
Shenyang,PM2.5,2/15/2017 14:00,2017,2,15,14,104,g/m,1 Hr,Valid
Shenyang,PM2.5,2/15/2017 15:00,2017,2,15,15,99,g/m,1 Hr,Valid
Shenyang,PM2.5,2/15/2017 16:00,2017,2,15,16,113,g/m,1 Hr,Valid
Shenyang,PM2.5,2/15/2017 17:00,2017,2,15,17,99,g/m,1 Hr,Valid
Shenyang,PM2.5,2/15/2017 18:00,2017,2,15,18,96,g/m,1 Hr,Valid
Shenyang,PM2.5,2/15/2017 19:00,2017,2,15,19,92,g/m,1 Hr,Valid
Shenyang,PM2.5,2/15/2017 20:00,2017,2,15,20,91,g/m,1 Hr,Valid
Shenyang,PM2.5,2/15/2017 21:00,2017,2,15,21,86,g/m,1 Hr,Valid
Shenyang,PM2.5,2/15/2017 22:00,2017,2,15,22,76,g/m,1 Hr,Valid
Shenyang,PM2.5,2/15/2017 23:00,2017,2,15,23,84,g/m,1 Hr,Valid
Shenyang,PM2.5,2/16/2017 0:00,2017,2,16,0,84,g/m,1 Hr,Valid
Shenyang,PM2.5,2/16/2017 1:00,2017,2,16,1,90,g/m,1 Hr,Valid
Shenyang,PM2.5,2/16/2017 2:00,2017,2,16,2,77,g/m,1 Hr,Valid
Shenyang,PM2.5,2/16/2017 3:00,2017,2,16,3,76,g/m,1 Hr,Valid
Shenyang,PM2.5,2/16/2017 4:00,2017,2,16,4,81,g/m,1 Hr,Valid
Shenyang,PM2.5,2/16/2017 5:00,2017,2,16,5,90,g/m,1 Hr,Valid
Shenyang,PM2.5,2/16/2017 6:00,2017,2,16,6,109,g/m,1 Hr,Valid
Shenyang,PM2.5,2/16/2017 7:00,2017,2,16,7,132,g/m,1 Hr,Valid
Shenyang,PM2.5,2/16/2017 8:00,2017,2,16,8,20,g/m,1 Hr,Valid
Shenyang,PM2.5,2/16/2017 9:00,2017,2,16,9,22,g/m,1 Hr,Valid
Shenyang,PM2.5,2/16/2017 10:00,2017,2,16,10,15,g/m,1 Hr,Valid
Shenyang,PM2.5,2/16/2017 11:00,2017,2,16,11,29,g/m,1 Hr,Valid
Shenyang,PM2.5,2/16/2017 12:00,2017,2,16,12,17,g/m,1 Hr,Valid
Shenyang,PM2.5,2/16/2017 13:00,2017,2,16,13,26,g/m,1 Hr,Valid
Shenyang,PM2.5,2/16/2017 14:00,2017,2,16,14,28,g/m,1 Hr,Valid
Shenyang,PM2.5,2/16/2017 15:00,2017,2,16,15,44,g/m,1 Hr,Valid
Shenyang,PM2.5,2/16/2017 16:00,2017,2,16,16,40,g/m,1 Hr,Valid
Shenyang,PM2.5,2/16/2017 17:00,2017,2,16,17,29,g/m,1 Hr,Valid
Shenyang,PM2.5,2/16/2017 18:00,2017,2,16,18,35,g/m,1 Hr,Valid
Shenyang,PM2.5,2/16/2017 19:00,2017,2,16,19,51,g/m,1 Hr,Valid
Shenyang,PM2.5,2/16/2017 20:00,2017,2,16,20,31,g/m,1 Hr,Valid
Shenyang,PM2.5,2/16/2017 21:00,2017,2,16,21,34,g/m,1 Hr,Valid
Shenyang,PM2.5,2/16/2017 22:00,2017,2,16,22,20,g/m,1 Hr,Valid
Shenyang,PM2.5,2/16/2017 23:00,2017,2,16,23,21,g/m,1 Hr,Valid
Shenyang,PM2.5,2/17/2017 0:00,2017,2,17,0,17,g/m,1 Hr,Valid
Shenyang,PM2.5,2/17/2017 1:00,2017,2,17,1,20,g/m,1 Hr,Valid
Shenyang,PM2.5,2/17/2017 2:00,2017,2,17,2,14,g/m,1 Hr,Valid
Shenyang,PM2.5,2/17/2017 3:00,2017,2,17,3,13,g/m,1 Hr,Valid
Shenyang,PM2.5,2/17/2017 4:00,2017,2,17,4,13,g/m,1 Hr,Valid
Shenyang,PM2.5,2/17/2017 5:00,2017,2,17,5,10,g/m,1 Hr,Valid
Shenyang,PM2.5,2/17/2017 6:00,2017,2,17,6,8,g/m,1 Hr,Valid
Shenyang,PM2.5,2/17/2017 7:00,2017,2,17,7,15,g/m,1 Hr,Valid
Shenyang,PM2.5,2/17/2017 8:00,2017,2,17,8,18,g/m,1 Hr,Valid
Shenyang,PM2.5,2/17/2017 9:00,2017,2,17,9,14,g/m,1 Hr,Valid
Shenyang,PM2.5,2/17/2017 10:00,2017,2,17,10,19,g/m,1 Hr,Valid
Shenyang,PM2.5,2/17/2017 11:00,2017,2,17,11,20,g/m,1 Hr,Valid
Shenyang,PM2.5,2/17/2017 12:00,2017,2,17,12,24,g/m,1 Hr,Valid
Shenyang,PM2.5,2/17/2017 13:00,2017,2,17,13,23,g/m,1 Hr,Valid
Shenyang,PM2.5,2/17/2017 14:00,2017,2,17,14,19,g/m,1 Hr,Valid
Shenyang,PM2.5,2/17/2017 15:00,2017,2,17,15,26,g/m,1 Hr,Valid
Shenyang,PM2.5,2/17/2017 16:00,2017,2,17,16,42,g/m,1 Hr,Valid
Shenyang,PM2.5,2/17/2017 17:00,2017,2,17,17,32,g/m,1 Hr,Valid
Shenyang,PM2.5,2/17/2017 18:00,2017,2,17,18,36,g/m,1 Hr,Valid
Shenyang,PM2.5,2/17/2017 19:00,2017,2,17,19,47,g/m,1 Hr,Valid
Shenyang,PM2.5,2/17/2017 20:00,2017,2,17,20,50,g/m,1 Hr,Valid
Shenyang,PM2.5,2/17/2017 21:00,2017,2,17,21,50,g/m,1 Hr,Valid
Shenyang,PM2.5,2/17/2017 22:00,2017,2,17,22,60,g/m,1 Hr,Valid
Shenyang,PM2.5,2/17/2017 23:00,2017,2,17,23,54,g/m,1 Hr,Valid
Shenyang,PM2.5,2/18/2017 0:00,2017,2,18,0,44,g/m,1 Hr,Valid
Shenyang,PM2.5,2/18/2017 1:00,2017,2,18,1,74,g/m,1 Hr,Valid
Shenyang,PM2.5,2/18/2017 2:00,2017,2,18,2,78,g/m,1 Hr,Valid
Shenyang,PM2.5,2/18/2017 3:00,2017,2,18,3,62,g/m,1 Hr,Valid
Shenyang,PM2.5,2/18/2017 4:00,2017,2,18,4,69,g/m,1 Hr,Valid
Shenyang,PM2.5,2/18/2017 5:00,2017,2,18,5,41,g/m,1 Hr,Valid
Shenyang,PM2.5,2/18/2017 6:00,2017,2,18,6,90,g/m,1 Hr,Valid
Shenyang,PM2.5,2/18/2017 7:00,2017,2,18,7,115,g/m,1 Hr,Valid
Shenyang,PM2.5,2/18/2017 8:00,2017,2,18,8,81,g/m,1 Hr,Valid
Shenyang,PM2.5,2/18/2017 9:00,2017,2,18,9,43,g/m,1 Hr,Valid
Shenyang,PM2.5,2/18/2017 10:00,2017,2,18,10,32,g/m,1 Hr,Valid
Shenyang,PM2.5,2/18/2017 11:00,2017,2,18,11,33,g/m,1 Hr,Valid
Shenyang,PM2.5,2/18/2017 12:00,2017,2,18,12,37,g/m,1 Hr,Valid
Shenyang,PM2.5,2/18/2017 13:00,2017,2,18,13,28,g/m,1 Hr,Valid
Shenyang,PM2.5,2/18/2017 14:00,2017,2,18,14,26,g/m,1 Hr,Valid
Shenyang,PM2.5,2/18/2017 15:00,2017,2,18,15,32,g/m,1 Hr,Valid
Shenyang,PM2.5,2/18/2017 16:00,2017,2,18,16,35,g/m,1 Hr,Valid
Shenyang,PM2.5,2/18/2017 17:00,2017,2,18,17,45,g/m,1 Hr,Valid
Shenyang,PM2.5,2/18/2017 18:00,2017,2,18,18,66,g/m,1 Hr,Valid
Shenyang,PM2.5,2/18/2017 19:00,2017,2,18,19,65,g/m,1 Hr,Valid
Shenyang,PM2.5,2/18/2017 20:00,2017,2,18,20,90,g/m,1 Hr,Valid
Shenyang,PM2.5,2/18/2017 21:00,2017,2,18,21,84,g/m,1 Hr,Valid
Shenyang,PM2.5,2/18/2017 22:00,2017,2,18,22,86,g/m,1 Hr,Valid
Shenyang,PM2.5,2/18/2017 23:00,2017,2,18,23,70,g/m,1 Hr,Valid
Shenyang,PM2.5,2/19/2017 0:00,2017,2,19,0,68,g/m,1 Hr,Valid
Shenyang,PM2.5,2/19/2017 1:00,2017,2,19,1,71,g/m,1 Hr,Valid
Shenyang,PM2.5,2/19/2017 2:00,2017,2,19,2,64,g/m,1 Hr,Valid
Shenyang,PM2.5,2/19/2017 3:00,2017,2,19,3,43,g/m,1 Hr,Valid
Shenyang,PM2.5,2/19/2017 4:00,2017,2,19,4,41,g/m,1 Hr,Valid
Shenyang,PM2.5,2/19/2017 5:00,2017,2,19,5,38,g/m,1 Hr,Valid
Shenyang,PM2.5,2/19/2017 6:00,2017,2,19,6,49,g/m,1 Hr,Valid
Shenyang,PM2.5,2/19/2017 7:00,2017,2,19,7,54,g/m,1 Hr,Valid
Shenyang,PM2.5,2/19/2017 8:00,2017,2,19,8,67,g/m,1 Hr,Valid
Shenyang,PM2.5,2/19/2017 9:00,2017,2,19,9,65,g/m,1 Hr,Valid
Shenyang,PM2.5,2/19/2017 10:00,2017,2,19,10,64,g/m,1 Hr,Valid
Shenyang,PM2.5,2/19/2017 11:00,2017,2,19,11,61,g/m,1 Hr,Valid
Shenyang,PM2.5,2/19/2017 12:00,2017,2,19,12,44,g/m,1 Hr,Valid
Shenyang,PM2.5,2/19/2017 13:00,2017,2,19,13,55,g/m,1 Hr,Valid
Shenyang,PM2.5,2/19/2017 14:00,2017,2,19,14,89,g/m,1 Hr,Valid
Shenyang,PM2.5,2/19/2017 15:00,2017,2,19,15,58,g/m,1 Hr,Valid
Shenyang,PM2.5,2/19/2017 16:00,2017,2,19,16,54,g/m,1 Hr,Valid
Shenyang,PM2.5,2/19/2017 17:00,2017,2,19,17,55,g/m,1 Hr,Valid
Shenyang,PM2.5,2/19/2017 18:00,2017,2,19,18,50,g/m,1 Hr,Valid
Shenyang,PM2.5,2/19/2017 19:00,2017,2,19,19,63,g/m,1 Hr,Valid
Shenyang,PM2.5,2/19/2017 20:00,2017,2,19,20,63,g/m,1 Hr,Valid
Shenyang,PM2.5,2/19/2017 21:00,2017,2,19,21,39,g/m,1 Hr,Valid
Shenyang,PM2.5,2/19/2017 22:00,2017,2,19,22,33,g/m,1 Hr,Valid
Shenyang,PM2.5,2/19/2017 23:00,2017,2,19,23,22,g/m,1 Hr,Valid
Shenyang,PM2.5,2/20/2017 0:00,2017,2,20,0,45,g/m,1 Hr,Valid
Shenyang,PM2.5,2/20/2017 1:00,2017,2,20,1,27,g/m,1 Hr,Valid
Shenyang,PM2.5,2/20/2017 2:00,2017,2,20,2,24,g/m,1 Hr,Valid
Shenyang,PM2.5,2/20/2017 3:00,2017,2,20,3,31,g/m,1 Hr,Valid
Shenyang,PM2.5,2/20/2017 4:00,2017,2,20,4,24,g/m,1 Hr,Valid
Shenyang,PM2.5,2/20/2017 5:00,2017,2,20,5,26,g/m,1 Hr,Valid
Shenyang,PM2.5,2/20/2017 6:00,2017,2,20,6,33,g/m,1 Hr,Valid
Shenyang,PM2.5,2/20/2017 7:00,2017,2,20,7,28,g/m,1 Hr,Valid
Shenyang,PM2.5,2/20/2017 8:00,2017,2,20,8,26,g/m,1 Hr,Valid
Shenyang,PM2.5,2/20/2017 9:00,2017,2,20,9,29,g/m,1 Hr,Valid
Shenyang,PM2.5,2/20/2017 10:00,2017,2,20,10,36,g/m,1 Hr,Valid
Shenyang,PM2.5,2/20/2017 11:00,2017,2,20,11,30,g/m,1 Hr,Valid
Shenyang,PM2.5,2/20/2017 12:00,2017,2,20,12,18,g/m,1 Hr,Valid
Shenyang,PM2.5,2/20/2017 13:00,2017,2,20,13,28,g/m,1 Hr,Valid
Shenyang,PM2.5,2/20/2017 14:00,2017,2,20,14,24,g/m,1 Hr,Valid
Shenyang,PM2.5,2/20/2017 15:00,2017,2,20,15,28,g/m,1 Hr,Valid
Shenyang,PM2.5,2/20/2017 16:00,2017,2,20,16,30,g/m,1 Hr,Valid
Shenyang,PM2.5,2/20/2017 17:00,2017,2,20,17,25,g/m,1 Hr,Valid
Shenyang,PM2.5,2/20/2017 18:00,2017,2,20,18,28,g/m,1 Hr,Valid
Shenyang,PM2.5,2/20/2017 19:00,2017,2,20,19,32,g/m,1 Hr,Valid
Shenyang,PM2.5,2/20/2017 20:00,2017,2,20,20,39,g/m,1 Hr,Valid
Shenyang,PM2.5,2/20/2017 21:00,2017,2,20,21,68,g/m,1 Hr,Valid
Shenyang,PM2.5,2/20/2017 22:00,2017,2,20,22,54,g/m,1 Hr,Valid
Shenyang,PM2.5,2/20/2017 23:00,2017,2,20,23,65,g/m,1 Hr,Valid
Shenyang,PM2.5,2/21/2017 0:00,2017,2,21,0,64,g/m,1 Hr,Valid
Shenyang,PM2.5,2/21/2017 1:00,2017,2,21,1,37,g/m,1 Hr,Valid
Shenyang,PM2.5,2/21/2017 2:00,2017,2,21,2,81,g/m,1 Hr,Valid
Shenyang,PM2.5,2/21/2017 3:00,2017,2,21,3,102,g/m,1 Hr,Valid
Shenyang,PM2.5,2/21/2017 4:00,2017,2,21,4,97,g/m,1 Hr,Valid
Shenyang,PM2.5,2/21/2017 5:00,2017,2,21,5,142,g/m,1 Hr,Valid
Shenyang,PM2.5,2/21/2017 6:00,2017,2,21,6,155,g/m,1 Hr,Valid
Shenyang,PM2.5,2/21/2017 7:00,2017,2,21,7,150,g/m,1 Hr,Valid
Shenyang,PM2.5,2/21/2017 8:00,2017,2,21,8,149,g/m,1 Hr,Valid
Shenyang,PM2.5,2/21/2017 9:00,2017,2,21,9,165,g/m,1 Hr,Valid
Shenyang,PM2.5,2/21/2017 10:00,2017,2,21,10,129,g/m,1 Hr,Valid
Shenyang,PM2.5,2/21/2017 11:00,2017,2,21,11,127,g/m,1 Hr,Valid
Shenyang,PM2.5,2/21/2017 12:00,2017,2,21,12,84,g/m,1 Hr,Valid
Shenyang,PM2.5,2/21/2017 13:00,2017,2,21,13,82,g/m,1 Hr,Valid
Shenyang,PM2.5,2/21/2017 14:00,2017,2,21,14,58,g/m,1 Hr,Valid
Shenyang,PM2.5,2/21/2017 15:00,2017,2,21,15,47,g/m,1 Hr,Valid
Shenyang,PM2.5,2/21/2017 16:00,2017,2,21,16,45,g/m,1 Hr,Valid
Shenyang,PM2.5,2/21/2017 17:00,2017,2,21,17,38,g/m,1 Hr,Valid
Shenyang,PM2.5,2/21/2017 18:00,2017,2,21,18,50,g/m,1 Hr,Valid
Shenyang,PM2.5,2/21/2017 19:00,2017,2,21,19,48,g/m,1 Hr,Valid
Shenyang,PM2.5,2/21/2017 20:00,2017,2,21,20,69,g/m,1 Hr,Valid
Shenyang,PM2.5,2/21/2017 21:00,2017,2,21,21,92,g/m,1 Hr,Valid
Shenyang,PM2.5,2/21/2017 22:00,2017,2,21,22,50,g/m,1 Hr,Valid
Shenyang,PM2.5,2/21/2017 23:00,2017,2,21,23,54,g/m,1 Hr,Valid
Shenyang,PM2.5,2/22/2017 0:00,2017,2,22,0,45,g/m,1 Hr,Valid
Shenyang,PM2.5,2/22/2017 1:00,2017,2,22,1,43,g/m,1 Hr,Valid
Shenyang,PM2.5,2/22/2017 2:00,2017,2,22,2,63,g/m,1 Hr,Valid
Shenyang,PM2.5,2/22/2017 3:00,2017,2,22,3,54,g/m,1 Hr,Valid
Shenyang,PM2.5,2/22/2017 4:00,2017,2,22,4,53,g/m,1 Hr,Valid
Shenyang,PM2.5,2/22/2017 5:00,2017,2,22,5,45,g/m,1 Hr,Valid
Shenyang,PM2.5,2/22/2017 6:00,2017,2,22,6,52,g/m,1 Hr,Valid
Shenyang,PM2.5,2/22/2017 7:00,2017,2,22,7,60,g/m,1 Hr,Valid
Shenyang,PM2.5,2/22/2017 8:00,2017,2,22,8,76,g/m,1 Hr,Valid
Shenyang,PM2.5,2/22/2017 9:00,2017,2,22,9,53,g/m,1 Hr,Valid
Shenyang,PM2.5,2/22/2017 10:00,2017,2,22,10,72,g/m,1 Hr,Valid
Shenyang,PM2.5,2/22/2017 11:00,2017,2,22,11,88,g/m,1 Hr,Valid
Shenyang,PM2.5,2/22/2017 12:00,2017,2,22,12,90,g/m,1 Hr,Valid
Shenyang,PM2.5,2/22/2017 13:00,2017,2,22,13,66,g/m,1 Hr,Valid
Shenyang,PM2.5,2/22/2017 14:00,2017,2,22,14,73,g/m,1 Hr,Valid
Shenyang,PM2.5,2/22/2017 15:00,2017,2,22,15,75,g/m,1 Hr,Valid
Shenyang,PM2.5,2/22/2017 16:00,2017,2,22,16,21,g/m,1 Hr,Valid
Shenyang,PM2.5,2/22/2017 17:00,2017,2,22,17,15,g/m,1 Hr,Valid
Shenyang,PM2.5,2/22/2017 18:00,2017,2,22,18,26,g/m,1 Hr,Valid
Shenyang,PM2.5,2/22/2017 19:00,2017,2,22,19,32,g/m,1 Hr,Valid
Shenyang,PM2.5,2/22/2017 20:00,2017,2,22,20,44,g/m,1 Hr,Valid
Shenyang,PM2.5,2/22/2017 21:00,2017,2,22,21,31,g/m,1 Hr,Valid
Shenyang,PM2.5,2/22/2017 22:00,2017,2,22,22,32,g/m,1 Hr,Valid
Shenyang,PM2.5,2/22/2017 23:00,2017,2,22,23,22,g/m,1 Hr,Valid
Shenyang,PM2.5,2/23/2017 0:00,2017,2,23,0,17,g/m,1 Hr,Valid
Shenyang,PM2.5,2/23/2017 1:00,2017,2,23,1,12,g/m,1 Hr,Valid
Shenyang,PM2.5,2/23/2017 2:00,2017,2,23,2,10,g/m,1 Hr,Valid
Shenyang,PM2.5,2/23/2017 3:00,2017,2,23,3,15,g/m,1 Hr,Valid
Shenyang,PM2.5,2/23/2017 4:00,2017,2,23,4,14,g/m,1 Hr,Valid
Shenyang,PM2.5,2/23/2017 5:00,2017,2,23,5,15,g/m,1 Hr,Valid
Shenyang,PM2.5,2/23/2017 6:00,2017,2,23,6,35,g/m,1 Hr,Valid
Shenyang,PM2.5,2/23/2017 7:00,2017,2,23,7,22,g/m,1 Hr,Valid
Shenyang,PM2.5,2/23/2017 8:00,2017,2,23,8,20,g/m,1 Hr,Valid
Shenyang,PM2.5,2/23/2017 9:00,2017,2,23,9,29,g/m,1 Hr,Valid
Shenyang,PM2.5,2/23/2017 10:00,2017,2,23,10,21,g/m,1 Hr,Valid
Shenyang,PM2.5,2/23/2017 11:00,2017,2,23,11,30,g/m,1 Hr,Valid
Shenyang,PM2.5,2/23/2017 12:00,2017,2,23,12,19,g/m,1 Hr,Valid
Shenyang,PM2.5,2/23/2017 13:00,2017,2,23,13,29,g/m,1 Hr,Valid
Shenyang,PM2.5,2/23/2017 14:00,2017,2,23,14,11,g/m,1 Hr,Valid
Shenyang,PM2.5,2/23/2017 15:00,2017,2,23,15,18,g/m,1 Hr,Valid
Shenyang,PM2.5,2/23/2017 16:00,2017,2,23,16,19,g/m,1 Hr,Valid
Shenyang,PM2.5,2/23/2017 17:00,2017,2,23,17,23,g/m,1 Hr,Valid
Shenyang,PM2.5,2/23/2017 18:00,2017,2,23,18,25,g/m,1 Hr,Valid
Shenyang,PM2.5,2/23/2017 19:00,2017,2,23,19,36,g/m,1 Hr,Valid
Shenyang,PM2.5,2/23/2017 20:00,2017,2,23,20,32,g/m,1 Hr,Valid
Shenyang,PM2.5,2/23/2017 21:00,2017,2,23,21,40,g/m,1 Hr,Valid
Shenyang,PM2.5,2/23/2017 22:00,2017,2,23,22,41,g/m,1 Hr,Valid
Shenyang,PM2.5,2/23/2017 23:00,2017,2,23,23,40,g/m,1 Hr,Valid
Shenyang,PM2.5,2/24/2017 0:00,2017,2,24,0,38,g/m,1 Hr,Valid
Shenyang,PM2.5,2/24/2017 1:00,2017,2,24,1,42,g/m,1 Hr,Valid
Shenyang,PM2.5,2/24/2017 2:00,2017,2,24,2,44,g/m,1 Hr,Valid
Shenyang,PM2.5,2/24/2017 3:00,2017,2,24,3,47,g/m,1 Hr,Valid
Shenyang,PM2.5,2/24/2017 4:00,2017,2,24,4,48,g/m,1 Hr,Valid
Shenyang,PM2.5,2/24/2017 5:00,2017,2,24,5,69,g/m,1 Hr,Valid
Shenyang,PM2.5,2/24/2017 6:00,2017,2,24,6,67,g/m,1 Hr,Valid
Shenyang,PM2.5,2/24/2017 7:00,2017,2,24,7,75,g/m,1 Hr,Valid
Shenyang,PM2.5,2/24/2017 8:00,2017,2,24,8,97,g/m,1 Hr,Valid
Shenyang,PM2.5,2/24/2017 9:00,2017,2,24,9,102,g/m,1 Hr,Valid
Shenyang,PM2.5,2/24/2017 10:00,2017,2,24,10,115,g/m,1 Hr,Valid
Shenyang,PM2.5,2/24/2017 11:00,2017,2,24,11,133,g/m,1 Hr,Valid
Shenyang,PM2.5,2/24/2017 12:00,2017,2,24,12,133,g/m,1 Hr,Valid
Shenyang,PM2.5,2/24/2017 13:00,2017,2,24,13,80,g/m,1 Hr,Valid
Shenyang,PM2.5,2/24/2017 14:00,2017,2,24,14,27,g/m,1 Hr,Valid
Shenyang,PM2.5,2/24/2017 15:00,2017,2,24,15,30,g/m,1 Hr,Valid
Shenyang,PM2.5,2/24/2017 16:00,2017,2,24,16,37,g/m,1 Hr,Valid
Shenyang,PM2.5,2/24/2017 17:00,2017,2,24,17,35,g/m,1 Hr,Valid
Shenyang,PM2.5,2/24/2017 18:00,2017,2,24,18,57,g/m,1 Hr,Valid
Shenyang,PM2.5,2/24/2017 19:00,2017,2,24,19,81,g/m,1 Hr,Valid
Shenyang,PM2.5,2/24/2017 20:00,2017,2,24,20,103,g/m,1 Hr,Valid
Shenyang,PM2.5,2/24/2017 21:00,2017,2,24,21,63,g/m,1 Hr,Valid
Shenyang,PM2.5,2/24/2017 22:00,2017,2,24,22,57,g/m,1 Hr,Valid
Shenyang,PM2.5,2/24/2017 23:00,2017,2,24,23,52,g/m,1 Hr,Valid
Shenyang,PM2.5,2/25/2017 0:00,2017,2,25,0,48,g/m,1 Hr,Valid
Shenyang,PM2.5,2/25/2017 1:00,2017,2,25,1,72,g/m,1 Hr,Valid
Shenyang,PM2.5,2/25/2017 2:00,2017,2,25,2,72,g/m,1 Hr,Valid
Shenyang,PM2.5,2/25/2017 3:00,2017,2,25,3,50,g/m,1 Hr,Valid
Shenyang,PM2.5,2/25/2017 4:00,2017,2,25,4,49,g/m,1 Hr,Valid
Shenyang,PM2.5,2/25/2017 5:00,2017,2,25,5,50,g/m,1 Hr,Valid
Shenyang,PM2.5,2/25/2017 6:00,2017,2,25,6,54,g/m,1 Hr,Valid
Shenyang,PM2.5,2/25/2017 7:00,2017,2,25,7,55,g/m,1 Hr,Valid
Shenyang,PM2.5,2/25/2017 8:00,2017,2,25,8,82,g/m,1 Hr,Valid
Shenyang,PM2.5,2/25/2017 9:00,2017,2,25,9,76,g/m,1 Hr,Valid
Shenyang,PM2.5,2/25/2017 10:00,2017,2,25,10,46,g/m,1 Hr,Valid
Shenyang,PM2.5,2/25/2017 11:00,2017,2,25,11,36,g/m,1 Hr,Valid
Shenyang,PM2.5,2/25/2017 12:00,2017,2,25,12,32,g/m,1 Hr,Valid
Shenyang,PM2.5,2/25/2017 13:00,2017,2,25,13,14,g/m,1 Hr,Valid
Shenyang,PM2.5,2/25/2017 14:00,2017,2,25,14,15,g/m,1 Hr,Valid
Shenyang,PM2.5,2/25/2017 15:00,2017,2,25,15,15,g/m,1 Hr,Valid
Shenyang,PM2.5,2/25/2017 16:00,2017,2,25,16,19,g/m,1 Hr,Valid
Shenyang,PM2.5,2/25/2017 17:00,2017,2,25,17,20,g/m,1 Hr,Valid
Shenyang,PM2.5,2/25/2017 18:00,2017,2,25,18,22,g/m,1 Hr,Valid
Shenyang,PM2.5,2/25/2017 19:00,2017,2,25,19,25,g/m,1 Hr,Valid
Shenyang,PM2.5,2/25/2017 20:00,2017,2,25,20,28,g/m,1 Hr,Valid
Shenyang,PM2.5,2/25/2017 21:00,2017,2,25,21,54,g/m,1 Hr,Valid
Shenyang,PM2.5,2/25/2017 22:00,2017,2,25,22,49,g/m,1 Hr,Valid
Shenyang,PM2.5,2/25/2017 23:00,2017,2,25,23,57,g/m,1 Hr,Valid
Shenyang,PM2.5,2/26/2017 0:00,2017,2,26,0,55,g/m,1 Hr,Valid
Shenyang,PM2.5,2/26/2017 1:00,2017,2,26,1,61,g/m,1 Hr,Valid
Shenyang,PM2.5,2/26/2017 2:00,2017,2,26,2,66,g/m,1 Hr,Valid
Shenyang,PM2.5,2/26/2017 3:00,2017,2,26,3,76,g/m,1 Hr,Valid
Shenyang,PM2.5,2/26/2017 4:00,2017,2,26,4,79,g/m,1 Hr,Valid
Shenyang,PM2.5,2/26/2017 5:00,2017,2,26,5,85,g/m,1 Hr,Valid
Shenyang,PM2.5,2/26/2017 6:00,2017,2,26,6,69,g/m,1 Hr,Valid
Shenyang,PM2.5,2/26/2017 7:00,2017,2,26,7,89,g/m,1 Hr,Valid
Shenyang,PM2.5,2/26/2017 8:00,2017,2,26,8,78,g/m,1 Hr,Valid
Shenyang,PM2.5,2/26/2017 9:00,2017,2,26,9,92,g/m,1 Hr,Valid
Shenyang,PM2.5,2/26/2017 10:00,2017,2,26,10,88,g/m,1 Hr,Valid
Shenyang,PM2.5,2/26/2017 11:00,2017,2,26,11,99,g/m,1 Hr,Valid
Shenyang,PM2.5,2/26/2017 12:00,2017,2,26,12,104,g/m,1 Hr,Valid
Shenyang,PM2.5,2/26/2017 13:00,2017,2,26,13,85,g/m,1 Hr,Valid
Shenyang,PM2.5,2/26/2017 14:00,2017,2,26,14,51,g/m,1 Hr,Valid
Shenyang,PM2.5,2/26/2017 15:00,2017,2,26,15,35,g/m,1 Hr,Valid
Shenyang,PM2.5,2/26/2017 16:00,2017,2,26,16,33,g/m,1 Hr,Valid
Shenyang,PM2.5,2/26/2017 17:00,2017,2,26,17,22,g/m,1 Hr,Valid
Shenyang,PM2.5,2/26/2017 18:00,2017,2,26,18,19,g/m,1 Hr,Valid
Shenyang,PM2.5,2/26/2017 19:00,2017,2,26,19,28,g/m,1 Hr,Valid
Shenyang,PM2.5,2/26/2017 20:00,2017,2,26,20,65,g/m,1 Hr,Valid
Shenyang,PM2.5,2/26/2017 21:00,2017,2,26,21,80,g/m,1 Hr,Valid
Shenyang,PM2.5,2/26/2017 22:00,2017,2,26,22,81,g/m,1 Hr,Valid
Shenyang,PM2.5,2/26/2017 23:00,2017,2,26,23,100,g/m,1 Hr,Valid
Shenyang,PM2.5,2/27/2017 0:00,2017,2,27,0,90,g/m,1 Hr,Valid
Shenyang,PM2.5,2/27/2017 1:00,2017,2,27,1,113,g/m,1 Hr,Valid
Shenyang,PM2.5,2/27/2017 2:00,2017,2,27,2,105,g/m,1 Hr,Valid
Shenyang,PM2.5,2/27/2017 3:00,2017,2,27,3,109,g/m,1 Hr,Valid
Shenyang,PM2.5,2/27/2017 4:00,2017,2,27,4,122,g/m,1 Hr,Valid
Shenyang,PM2.5,2/27/2017 5:00,2017,2,27,5,116,g/m,1 Hr,Valid
Shenyang,PM2.5,2/27/2017 6:00,2017,2,27,6,114,g/m,1 Hr,Valid
Shenyang,PM2.5,2/27/2017 7:00,2017,2,27,7,121,g/m,1 Hr,Valid
Shenyang,PM2.5,2/27/2017 8:00,2017,2,27,8,110,g/m,1 Hr,Valid
Shenyang,PM2.5,2/27/2017 9:00,2017,2,27,9,115,g/m,1 Hr,Valid
Shenyang,PM2.5,2/27/2017 10:00,2017,2,27,10,67,g/m,1 Hr,Valid
Shenyang,PM2.5,2/27/2017 11:00,2017,2,27,11,43,g/m,1 Hr,Valid
Shenyang,PM2.5,2/27/2017 12:00,2017,2,27,12,41,g/m,1 Hr,Valid
Shenyang,PM2.5,2/27/2017 13:00,2017,2,27,13,31,g/m,1 Hr,Valid
Shenyang,PM2.5,2/27/2017 14:00,2017,2,27,14,34,g/m,1 Hr,Valid
Shenyang,PM2.5,2/27/2017 15:00,2017,2,27,15,39,g/m,1 Hr,Valid
Shenyang,PM2.5,2/27/2017 16:00,2017,2,27,16,27,g/m,1 Hr,Valid
Shenyang,PM2.5,2/27/2017 17:00,2017,2,27,17,33,g/m,1 Hr,Valid
Shenyang,PM2.5,2/27/2017 18:00,2017,2,27,18,37,g/m,1 Hr,Valid
Shenyang,PM2.5,2/27/2017 19:00,2017,2,27,19,46,g/m,1 Hr,Valid
Shenyang,PM2.5,2/27/2017 20:00,2017,2,27,20,37,g/m,1 Hr,Valid
Shenyang,PM2.5,2/27/2017 21:00,2017,2,27,21,40,g/m,1 Hr,Valid
Shenyang,PM2.5,2/27/2017 22:00,2017,2,27,22,41,g/m,1 Hr,Valid
Shenyang,PM2.5,2/27/2017 23:00,2017,2,27,23,37,g/m,1 Hr,Valid
Shenyang,PM2.5,2/28/2017 0:00,2017,2,28,0,40,g/m,1 Hr,Valid
Shenyang,PM2.5,2/28/2017 1:00,2017,2,28,1,51,g/m,1 Hr,Valid
Shenyang,PM2.5,2/28/2017 2:00,2017,2,28,2,41,g/m,1 Hr,Valid
Shenyang,PM2.5,2/28/2017 3:00,2017,2,28,3,48,g/m,1 Hr,Valid
Shenyang,PM2.5,2/28/2017 4:00,2017,2,28,4,64,g/m,1 Hr,Valid
Shenyang,PM2.5,2/28/2017 5:00,2017,2,28,5,68,g/m,1 Hr,Valid
Shenyang,PM2.5,2/28/2017 6:00,2017,2,28,6,83,g/m,1 Hr,Valid
Shenyang,PM2.5,2/28/2017 7:00,2017,2,28,7,83,g/m,1 Hr,Valid
Shenyang,PM2.5,2/28/2017 8:00,2017,2,28,8,78,g/m,1 Hr,Valid
Shenyang,PM2.5,2/28/2017 9:00,2017,2,28,9,64,g/m,1 Hr,Valid
Shenyang,PM2.5,2/28/2017 10:00,2017,2,28,10,76,g/m,1 Hr,Valid
Shenyang,PM2.5,2/28/2017 11:00,2017,2,28,11,85,g/m,1 Hr,Valid
Shenyang,PM2.5,2/28/2017 12:00,2017,2,28,12,91,g/m,1 Hr,Valid
Shenyang,PM2.5,2/28/2017 13:00,2017,2,28,13,96,g/m,1 Hr,Valid
Shenyang,PM2.5,2/28/2017 14:00,2017,2,28,14,93,g/m,1 Hr,Valid
Shenyang,PM2.5,2/28/2017 15:00,2017,2,28,15,109,g/m,1 Hr,Valid
Shenyang,PM2.5,2/28/2017 16:00,2017,2,28,16,109,g/m,1 Hr,Valid
Shenyang,PM2.5,2/28/2017 17:00,2017,2,28,17,103,g/m,1 Hr,Valid
Shenyang,PM2.5,2/28/2017 18:00,2017,2,28,18,80,g/m,1 Hr,Valid
Shenyang,PM2.5,2/28/2017 19:00,2017,2,28,19,85,g/m,1 Hr,Valid
Shenyang,PM2.5,2/28/2017 20:00,2017,2,28,20,85,g/m,1 Hr,Valid
Shenyang,PM2.5,2/28/2017 21:00,2017,2,28,21,86,g/m,1 Hr,Valid
Shenyang,PM2.5,2/28/2017 22:00,2017,2,28,22,29,g/m,1 Hr,Valid
Shenyang,PM2.5,2/28/2017 23:00,2017,2,28,23,29,g/m,1 Hr,Valid
Shenyang,PM2.5,3/1/2017 0:00,2017,3,1,0,21,g/m,1 Hr,Valid
Shenyang,PM2.5,3/1/2017 1:00,2017,3,1,1,13,g/m,1 Hr,Valid
Shenyang,PM2.5,3/1/2017 2:00,2017,3,1,2,17,g/m,1 Hr,Valid
Shenyang,PM2.5,3/1/2017 3:00,2017,3,1,3,9,g/m,1 Hr,Valid
Shenyang,PM2.5,3/1/2017 4:00,2017,3,1,4,8,g/m,1 Hr,Valid
Shenyang,PM2.5,3/1/2017 5:00,2017,3,1,5,12,g/m,1 Hr,Valid
Shenyang,PM2.5,3/1/2017 6:00,2017,3,1,6,11,g/m,1 Hr,Valid
Shenyang,PM2.5,3/1/2017 7:00,2017,3,1,7,19,g/m,1 Hr,Valid
Shenyang,PM2.5,3/1/2017 8:00,2017,3,1,8,8,g/m,1 Hr,Valid
Shenyang,PM2.5,3/1/2017 9:00,2017,3,1,9,7,g/m,1 Hr,Valid
Shenyang,PM2.5,3/1/2017 10:00,2017,3,1,10,9,g/m,1 Hr,Valid
Shenyang,PM2.5,3/1/2017 11:00,2017,3,1,11,14,g/m,1 Hr,Valid
Shenyang,PM2.5,3/1/2017 12:00,2017,3,1,12,9,g/m,1 Hr,Valid
Shenyang,PM2.5,3/1/2017 13:00,2017,3,1,13,8,g/m,1 Hr,Valid
Shenyang,PM2.5,3/1/2017 14:00,2017,3,1,14,8,g/m,1 Hr,Valid
Shenyang,PM2.5,3/1/2017 15:00,2017,3,1,15,11,g/m,1 Hr,Valid
Shenyang,PM2.5,3/1/2017 16:00,2017,3,1,16,17,g/m,1 Hr,Valid
Shenyang,PM2.5,3/1/2017 17:00,2017,3,1,17,21,g/m,1 Hr,Valid
Shenyang,PM2.5,3/1/2017 18:00,2017,3,1,18,18,g/m,1 Hr,Valid
Shenyang,PM2.5,3/1/2017 19:00,2017,3,1,19,11,g/m,1 Hr,Valid
Shenyang,PM2.5,3/1/2017 20:00,2017,3,1,20,18,g/m,1 Hr,Valid
Shenyang,PM2.5,3/1/2017 21:00,2017,3,1,21,19,g/m,1 Hr,Valid
Shenyang,PM2.5,3/1/2017 22:00,2017,3,1,22,22,g/m,1 Hr,Valid
Shenyang,PM2.5,3/1/2017 23:00,2017,3,1,23,18,g/m,1 Hr,Valid
Shenyang,PM2.5,3/2/2017 0:00,2017,3,2,0,21,g/m,1 Hr,Valid
Shenyang,PM2.5,3/2/2017 1:00,2017,3,2,1,25,g/m,1 Hr,Valid
Shenyang,PM2.5,3/2/2017 2:00,2017,3,2,2,28,g/m,1 Hr,Valid
Shenyang,PM2.5,3/2/2017 3:00,2017,3,2,3,35,g/m,1 Hr,Valid
Shenyang,PM2.5,3/2/2017 4:00,2017,3,2,4,27,g/m,1 Hr,Valid
Shenyang,PM2.5,3/2/2017 5:00,2017,3,2,5,29,g/m,1 Hr,Valid
Shenyang,PM2.5,3/2/2017 6:00,2017,3,2,6,40,g/m,1 Hr,Valid
Shenyang,PM2.5,3/2/2017 7:00,2017,3,2,7,77,g/m,1 Hr,Valid
Shenyang,PM2.5,3/2/2017 8:00,2017,3,2,8,94,g/m,1 Hr,Valid
Shenyang,PM2.5,3/2/2017 9:00,2017,3,2,9,75,g/m,1 Hr,Valid
Shenyang,PM2.5,3/2/2017 10:00,2017,3,2,10,71,g/m,1 Hr,Valid
Shenyang,PM2.5,3/2/2017 11:00,2017,3,2,11,38,g/m,1 Hr,Valid
Shenyang,PM2.5,3/2/2017 12:00,2017,3,2,12,34,g/m,1 Hr,Valid
Shenyang,PM2.5,3/2/2017 13:00,2017,3,2,13,34,g/m,1 Hr,Valid
Shenyang,PM2.5,3/2/2017 14:00,2017,3,2,14,34,g/m,1 Hr,Valid
Shenyang,PM2.5,3/2/2017 15:00,2017,3,2,15,47,g/m,1 Hr,Valid
Shenyang,PM2.5,3/2/2017 16:00,2017,3,2,16,59,g/m,1 Hr,Valid
Shenyang,PM2.5,3/2/2017 17:00,2017,3,2,17,43,g/m,1 Hr,Valid
Shenyang,PM2.5,3/2/2017 18:00,2017,3,2,18,44,g/m,1 Hr,Valid
Shenyang,PM2.5,3/2/2017 19:00,2017,3,2,19,54,g/m,1 Hr,Valid
Shenyang,PM2.5,3/2/2017 20:00,2017,3,2,20,62,g/m,1 Hr,Valid
Shenyang,PM2.5,3/2/2017 21:00,2017,3,2,21,66,g/m,1 Hr,Valid
Shenyang,PM2.5,3/2/2017 22:00,2017,3,2,22,66,g/m,1 Hr,Valid
Shenyang,PM2.5,3/2/2017 23:00,2017,3,2,23,53,g/m,1 Hr,Valid
Shenyang,PM2.5,3/3/2017 0:00,2017,3,3,0,68,g/m,1 Hr,Valid
Shenyang,PM2.5,3/3/2017 1:00,2017,3,3,1,73,g/m,1 Hr,Valid
Shenyang,PM2.5,3/3/2017 2:00,2017,3,3,2,70,g/m,1 Hr,Valid
Shenyang,PM2.5,3/3/2017 3:00,2017,3,3,3,73,g/m,1 Hr,Valid
Shenyang,PM2.5,3/3/2017 4:00,2017,3,3,4,71,g/m,1 Hr,Valid
Shenyang,PM2.5,3/3/2017 5:00,2017,3,3,5,98,g/m,1 Hr,Valid
Shenyang,PM2.5,3/3/2017 6:00,2017,3,3,6,92,g/m,1 Hr,Valid
Shenyang,PM2.5,3/3/2017 7:00,2017,3,3,7,50,g/m,1 Hr,Valid
Shenyang,PM2.5,3/3/2017 8:00,2017,3,3,8,36,g/m,1 Hr,Valid
Shenyang,PM2.5,3/3/2017 9:00,2017,3,3,9,40,g/m,1 Hr,Valid
Shenyang,PM2.5,3/3/2017 10:00,2017,3,3,10,36,g/m,1 Hr,Valid
Shenyang,PM2.5,3/3/2017 11:00,2017,3,3,11,46,g/m,1 Hr,Valid
Shenyang,PM2.5,3/3/2017 12:00,2017,3,3,12,40,g/m,1 Hr,Valid
Shenyang,PM2.5,3/3/2017 13:00,2017,3,3,13,31,g/m,1 Hr,Valid
Shenyang,PM2.5,3/3/2017 14:00,2017,3,3,14,22,g/m,1 Hr,Valid
Shenyang,PM2.5,3/3/2017 15:00,2017,3,3,15,19,g/m,1 Hr,Valid
Shenyang,PM2.5,3/3/2017 16:00,2017,3,3,16,30,g/m,1 Hr,Valid
Shenyang,PM2.5,3/3/2017 17:00,2017,3,3,17,37,g/m,1 Hr,Valid
Shenyang,PM2.5,3/3/2017 18:00,2017,3,3,18,52,g/m,1 Hr,Valid
Shenyang,PM2.5,3/3/2017 19:00,2017,3,3,19,69,g/m,1 Hr,Valid
Shenyang,PM2.5,3/3/2017 20:00,2017,3,3,20,58,g/m,1 Hr,Valid
Shenyang,PM2.5,3/3/2017 21:00,2017,3,3,21,63,g/m,1 Hr,Valid
Shenyang,PM2.5,3/3/2017 22:00,2017,3,3,22,67,g/m,1 Hr,Valid
Shenyang,PM2.5,3/3/2017 23:00,2017,3,3,23,70,g/m,1 Hr,Valid
Shenyang,PM2.5,3/4/2017 0:00,2017,3,4,0,67,g/m,1 Hr,Valid
Shenyang,PM2.5,3/4/2017 1:00,2017,3,4,1,53,g/m,1 Hr,Valid
Shenyang,PM2.5,3/4/2017 2:00,2017,3,4,2,61,g/m,1 Hr,Valid
Shenyang,PM2.5,3/4/2017 3:00,2017,3,4,3,82,g/m,1 Hr,Valid
Shenyang,PM2.5,3/4/2017 4:00,2017,3,4,4,88,g/m,1 Hr,Valid
Shenyang,PM2.5,3/4/2017 5:00,2017,3,4,5,91,g/m,1 Hr,Valid
Shenyang,PM2.5,3/4/2017 6:00,2017,3,4,6,79,g/m,1 Hr,Valid
Shenyang,PM2.5,3/4/2017 7:00,2017,3,4,7,75,g/m,1 Hr,Valid
Shenyang,PM2.5,3/4/2017 8:00,2017,3,4,8,85,g/m,1 Hr,Valid
Shenyang,PM2.5,3/4/2017 9:00,2017,3,4,9,98,g/m,1 Hr,Valid
Shenyang,PM2.5,3/4/2017 10:00,2017,3,4,10,80,g/m,1 Hr,Valid
Shenyang,PM2.5,3/4/2017 11:00,2017,3,4,11,83,g/m,1 Hr,Valid
Shenyang,PM2.5,3/4/2017 12:00,2017,3,4,12,47,g/m,1 Hr,Valid
Shenyang,PM2.5,3/4/2017 13:00,2017,3,4,13,40,g/m,1 Hr,Valid
Shenyang,PM2.5,3/4/2017 14:00,2017,3,4,14,18,g/m,1 Hr,Valid
Shenyang,PM2.5,3/4/2017 15:00,2017,3,4,15,15,g/m,1 Hr,Valid
Shenyang,PM2.5,3/4/2017 16:00,2017,3,4,16,20,g/m,1 Hr,Valid
Shenyang,PM2.5,3/4/2017 17:00,2017,3,4,17,19,g/m,1 Hr,Valid
Shenyang,PM2.5,3/4/2017 18:00,2017,3,4,18,24,g/m,1 Hr,Valid
Shenyang,PM2.5,3/4/2017 19:00,2017,3,4,19,75,g/m,1 Hr,Valid
Shenyang,PM2.5,3/4/2017 20:00,2017,3,4,20,102,g/m,1 Hr,Valid
Shenyang,PM2.5,3/4/2017 21:00,2017,3,4,21,83,g/m,1 Hr,Valid
Shenyang,PM2.5,3/4/2017 22:00,2017,3,4,22,59,g/m,1 Hr,Valid
Shenyang,PM2.5,3/4/2017 23:00,2017,3,4,23,48,g/m,1 Hr,Valid
Shenyang,PM2.5,3/5/2017 0:00,2017,3,5,0,51,g/m,1 Hr,Valid
Shenyang,PM2.5,3/5/2017 1:00,2017,3,5,1,38,g/m,1 Hr,Valid
Shenyang,PM2.5,3/5/2017 2:00,2017,3,5,2,41,g/m,1 Hr,Valid
Shenyang,PM2.5,3/5/2017 3:00,2017,3,5,3,38,g/m,1 Hr,Valid
Shenyang,PM2.5,3/5/2017 4:00,2017,3,5,4,30,g/m,1 Hr,Valid
Shenyang,PM2.5,3/5/2017 5:00,2017,3,5,5,33,g/m,1 Hr,Valid
Shenyang,PM2.5,3/5/2017 6:00,2017,3,5,6,26,g/m,1 Hr,Valid
Shenyang,PM2.5,3/5/2017 7:00,2017,3,5,7,38,g/m,1 Hr,Valid
Shenyang,PM2.5,3/5/2017 8:00,2017,3,5,8,24,g/m,1 Hr,Valid
Shenyang,PM2.5,3/5/2017 9:00,2017,3,5,9,43,g/m,1 Hr,Valid
Shenyang,PM2.5,3/5/2017 10:00,2017,3,5,10,36,g/m,1 Hr,Valid
Shenyang,PM2.5,3/5/2017 11:00,2017,3,5,11,37,g/m,1 Hr,Valid
Shenyang,PM2.5,3/5/2017 12:00,2017,3,5,12,30,g/m,1 Hr,Valid
Shenyang,PM2.5,3/5/2017 13:00,2017,3,5,13,33,g/m,1 Hr,Valid
Shenyang,PM2.5,3/5/2017 14:00,2017,3,5,14,30,g/m,1 Hr,Valid
Shenyang,PM2.5,3/5/2017 15:00,2017,3,5,15,47,g/m,1 Hr,Valid
Shenyang,PM2.5,3/5/2017 16:00,2017,3,5,16,47,g/m,1 Hr,Valid
Shenyang,PM2.5,3/5/2017 17:00,2017,3,5,17,49,g/m,1 Hr,Valid
Shenyang,PM2.5,3/5/2017 18:00,2017,3,5,18,42,g/m,1 Hr,Valid
Shenyang,PM2.5,3/5/2017 19:00,2017,3,5,19,41,g/m,1 Hr,Valid
Shenyang,PM2.5,3/5/2017 20:00,2017,3,5,20,41,g/m,1 Hr,Valid
Shenyang,PM2.5,3/5/2017 21:00,2017,3,5,21,28,g/m,1 Hr,Valid
Shenyang,PM2.5,3/5/2017 22:00,2017,3,5,22,41,g/m,1 Hr,Valid
Shenyang,PM2.5,3/5/2017 23:00,2017,3,5,23,32,g/m,1 Hr,Valid
Shenyang,PM2.5,3/6/2017 0:00,2017,3,6,0,28,g/m,1 Hr,Valid
Shenyang,PM2.5,3/6/2017 1:00,2017,3,6,1,28,g/m,1 Hr,Valid
Shenyang,PM2.5,3/6/2017 2:00,2017,3,6,2,50,g/m,1 Hr,Valid
Shenyang,PM2.5,3/6/2017 3:00,2017,3,6,3,49,g/m,1 Hr,Valid
Shenyang,PM2.5,3/6/2017 4:00,2017,3,6,4,55,g/m,1 Hr,Valid
Shenyang,PM2.5,3/6/2017 5:00,2017,3,6,5,41,g/m,1 Hr,Valid
Shenyang,PM2.5,3/6/2017 6:00,2017,3,6,6,25,g/m,1 Hr,Valid
Shenyang,PM2.5,3/6/2017 7:00,2017,3,6,7,22,g/m,1 Hr,Valid
Shenyang,PM2.5,3/6/2017 8:00,2017,3,6,8,20,g/m,1 Hr,Valid
Shenyang,PM2.5,3/6/2017 9:00,2017,3,6,9,24,g/m,1 Hr,Valid
Shenyang,PM2.5,3/6/2017 10:00,2017,3,6,10,15,g/m,1 Hr,Valid
Shenyang,PM2.5,3/6/2017 11:00,2017,3,6,11,17,g/m,1 Hr,Valid
Shenyang,PM2.5,3/6/2017 12:00,2017,3,6,12,24,g/m,1 Hr,Valid
Shenyang,PM2.5,3/6/2017 13:00,2017,3,6,13,18,g/m,1 Hr,Valid
Shenyang,PM2.5,3/6/2017 14:00,2017,3,6,14,16,g/m,1 Hr,Valid
Shenyang,PM2.5,3/6/2017 15:00,2017,3,6,15,22,g/m,1 Hr,Valid
Shenyang,PM2.5,3/6/2017 16:00,2017,3,6,16,20,g/m,1 Hr,Valid
Shenyang,PM2.5,3/6/2017 17:00,2017,3,6,17,19,g/m,1 Hr,Valid
Shenyang,PM2.5,3/6/2017 18:00,2017,3,6,18,16,g/m,1 Hr,Valid
Shenyang,PM2.5,3/6/2017 19:00,2017,3,6,19,16,g/m,1 Hr,Valid
Shenyang,PM2.5,3/6/2017 20:00,2017,3,6,20,20,g/m,1 Hr,Valid
Shenyang,PM2.5,3/6/2017 21:00,2017,3,6,21,26,g/m,1 Hr,Valid
Shenyang,PM2.5,3/6/2017 22:00,2017,3,6,22,15,g/m,1 Hr,Valid
Shenyang,PM2.5,3/6/2017 23:00,2017,3,6,23,15,g/m,1 Hr,Valid
Shenyang,PM2.5,3/7/2017 0:00,2017,3,7,0,15,g/m,1 Hr,Valid
Shenyang,PM2.5,3/7/2017 1:00,2017,3,7,1,27,g/m,1 Hr,Valid
Shenyang,PM2.5,3/7/2017 2:00,2017,3,7,2,25,g/m,1 Hr,Valid
Shenyang,PM2.5,3/7/2017 3:00,2017,3,7,3,23,g/m,1 Hr,Valid
Shenyang,PM2.5,3/7/2017 4:00,2017,3,7,4,12,g/m,1 Hr,Valid
Shenyang,PM2.5,3/7/2017 5:00,2017,3,7,5,14,g/m,1 Hr,Valid
Shenyang,PM2.5,3/7/2017 6:00,2017,3,7,6,22,g/m,1 Hr,Valid
Shenyang,PM2.5,3/7/2017 7:00,2017,3,7,7,19,g/m,1 Hr,Valid
Shenyang,PM2.5,3/7/2017 8:00,2017,3,7,8,16,g/m,1 Hr,Valid
Shenyang,PM2.5,3/7/2017 9:00,2017,3,7,9,26,g/m,1 Hr,Valid
Shenyang,PM2.5,3/7/2017 10:00,2017,3,7,10,22,g/m,1 Hr,Valid
Shenyang,PM2.5,3/7/2017 11:00,2017,3,7,11,25,g/m,1 Hr,Valid
Shenyang,PM2.5,3/7/2017 12:00,2017,3,7,12,32,g/m,1 Hr,Valid
Shenyang,PM2.5,3/7/2017 13:00,2017,3,7,13,24,g/m,1 Hr,Valid
Shenyang,PM2.5,3/7/2017 14:00,2017,3,7,14,23,g/m,1 Hr,Valid
Shenyang,PM2.5,3/7/2017 15:00,2017,3,7,15,24,g/m,1 Hr,Valid
Shenyang,PM2.5,3/7/2017 16:00,2017,3,7,16,24,g/m,1 Hr,Valid
Shenyang,PM2.5,3/7/2017 17:00,2017,3,7,17,23,g/m,1 Hr,Valid
Shenyang,PM2.5,3/7/2017 18:00,2017,3,7,18,20,g/m,1 Hr,Valid
Shenyang,PM2.5,3/7/2017 19:00,2017,3,7,19,27,g/m,1 Hr,Valid
Shenyang,PM2.5,3/7/2017 20:00,2017,3,7,20,36,g/m,1 Hr,Valid
Shenyang,PM2.5,3/7/2017 21:00,2017,3,7,21,65,g/m,1 Hr,Valid
Shenyang,PM2.5,3/7/2017 22:00,2017,3,7,22,83,g/m,1 Hr,Valid
Shenyang,PM2.5,3/7/2017 23:00,2017,3,7,23,54,g/m,1 Hr,Valid
Shenyang,PM2.5,3/8/2017 0:00,2017,3,8,0,45,g/m,1 Hr,Valid
Shenyang,PM2.5,3/8/2017 1:00,2017,3,8,1,44,g/m,1 Hr,Valid
Shenyang,PM2.5,3/8/2017 2:00,2017,3,8,2,51,g/m,1 Hr,Valid
Shenyang,PM2.5,3/8/2017 3:00,2017,3,8,3,16,g/m,1 Hr,Valid
Shenyang,PM2.5,3/8/2017 4:00,2017,3,8,4,26,g/m,1 Hr,Valid
Shenyang,PM2.5,3/8/2017 5:00,2017,3,8,5,23,g/m,1 Hr,Valid
Shenyang,PM2.5,3/8/2017 6:00,2017,3,8,6,24,g/m,1 Hr,Valid
Shenyang,PM2.5,3/8/2017 7:00,2017,3,8,7,22,g/m,1 Hr,Valid
Shenyang,PM2.5,3/8/2017 8:00,2017,3,8,8,29,g/m,1 Hr,Valid
Shenyang,PM2.5,3/8/2017 9:00,2017,3,8,9,39,g/m,1 Hr,Valid
Shenyang,PM2.5,3/8/2017 10:00,2017,3,8,10,43,g/m,1 Hr,Valid
Shenyang,PM2.5,3/8/2017 11:00,2017,3,8,11,39,g/m,1 Hr,Valid
Shenyang,PM2.5,3/8/2017 12:00,2017,3,8,12,35,g/m,1 Hr,Valid
Shenyang,PM2.5,3/8/2017 13:00,2017,3,8,13,30,g/m,1 Hr,Valid
Shenyang,PM2.5,3/8/2017 14:00,2017,3,8,14,22,g/m,1 Hr,Valid
Shenyang,PM2.5,3/8/2017 15:00,2017,3,8,15,27,g/m,1 Hr,Valid
Shenyang,PM2.5,3/8/2017 16:00,2017,3,8,16,27,g/m,1 Hr,Valid
Shenyang,PM2.5,3/8/2017 17:00,2017,3,8,17,30,g/m,1 Hr,Valid
Shenyang,PM2.5,3/8/2017 18:00,2017,3,8,18,23,g/m,1 Hr,Valid
Shenyang,PM2.5,3/8/2017 19:00,2017,3,8,19,47,g/m,1 Hr,Valid
Shenyang,PM2.5,3/8/2017 20:00,2017,3,8,20,81,g/m,1 Hr,Valid
Shenyang,PM2.5,3/8/2017 21:00,2017,3,8,21,54,g/m,1 Hr,Valid
Shenyang,PM2.5,3/8/2017 22:00,2017,3,8,22,44,g/m,1 Hr,Valid
Shenyang,PM2.5,3/8/2017 23:00,2017,3,8,23,48,g/m,1 Hr,Valid
Shenyang,PM2.5,3/9/2017 0:00,2017,3,9,0,47,g/m,1 Hr,Valid
Shenyang,PM2.5,3/9/2017 1:00,2017,3,9,1,45,g/m,1 Hr,Valid
Shenyang,PM2.5,3/9/2017 2:00,2017,3,9,2,38,g/m,1 Hr,Valid
Shenyang,PM2.5,3/9/2017 3:00,2017,3,9,3,28,g/m,1 Hr,Valid
Shenyang,PM2.5,3/9/2017 4:00,2017,3,9,4,17,g/m,1 Hr,Valid
Shenyang,PM2.5,3/9/2017 5:00,2017,3,9,5,17,g/m,1 Hr,Valid
Shenyang,PM2.5,3/9/2017 6:00,2017,3,9,6,15,g/m,1 Hr,Valid
Shenyang,PM2.5,3/9/2017 7:00,2017,3,9,7,29,g/m,1 Hr,Valid
Shenyang,PM2.5,3/9/2017 8:00,2017,3,9,8,19,g/m,1 Hr,Valid
Shenyang,PM2.5,3/9/2017 9:00,2017,3,9,9,23,g/m,1 Hr,Valid
Shenyang,PM2.5,3/9/2017 10:00,2017,3,9,10,20,g/m,1 Hr,Valid
Shenyang,PM2.5,3/9/2017 11:00,2017,3,9,11,32,g/m,1 Hr,Valid
Shenyang,PM2.5,3/9/2017 12:00,2017,3,9,12,44,g/m,1 Hr,Valid
Shenyang,PM2.5,3/9/2017 13:00,2017,3,9,13,43,g/m,1 Hr,Valid
Shenyang,PM2.5,3/9/2017 14:00,2017,3,9,14,29,g/m,1 Hr,Valid
Shenyang,PM2.5,3/9/2017 15:00,2017,3,9,15,26,g/m,1 Hr,Valid
Shenyang,PM2.5,3/9/2017 16:00,2017,3,9,16,21,g/m,1 Hr,Valid
Shenyang,PM2.5,3/9/2017 17:00,2017,3,9,17,36,g/m,1 Hr,Valid
Shenyang,PM2.5,3/9/2017 18:00,2017,3,9,18,31,g/m,1 Hr,Valid
Shenyang,PM2.5,3/9/2017 19:00,2017,3,9,19,43,g/m,1 Hr,Valid
Shenyang,PM2.5,3/9/2017 20:00,2017,3,9,20,56,g/m,1 Hr,Valid
Shenyang,PM2.5,3/9/2017 21:00,2017,3,9,21,58,g/m,1 Hr,Valid
Shenyang,PM2.5,3/9/2017 22:00,2017,3,9,22,66,g/m,1 Hr,Valid
Shenyang,PM2.5,3/9/2017 23:00,2017,3,9,23,96,g/m,1 Hr,Valid
Shenyang,PM2.5,3/10/2017 0:00,2017,3,10,0,146,g/m,1 Hr,Valid
Shenyang,PM2.5,3/10/2017 1:00,2017,3,10,1,142,g/m,1 Hr,Valid
Shenyang,PM2.5,3/10/2017 2:00,2017,3,10,2,81,g/m,1 Hr,Valid
Shenyang,PM2.5,3/10/2017 3:00,2017,3,10,3,63,g/m,1 Hr,Valid
Shenyang,PM2.5,3/10/2017 4:00,2017,3,10,4,60,g/m,1 Hr,Valid
Shenyang,PM2.5,3/10/2017 5:00,2017,3,10,5,62,g/m,1 Hr,Valid
Shenyang,PM2.5,3/10/2017 6:00,2017,3,10,6,64,g/m,1 Hr,Valid
Shenyang,PM2.5,3/10/2017 7:00,2017,3,10,7,61,g/m,1 Hr,Valid
Shenyang,PM2.5,3/10/2017 8:00,2017,3,10,8,77,g/m,1 Hr,Valid
Shenyang,PM2.5,3/10/2017 9:00,2017,3,10,9,85,g/m,1 Hr,Valid
Shenyang,PM2.5,3/10/2017 10:00,2017,3,10,10,95,g/m,1 Hr,Valid
Shenyang,PM2.5,3/10/2017 11:00,2017,3,10,11,-999,g/m,1 Hr,Missing
Shenyang,PM2.5,3/10/2017 12:00,2017,3,10,12,102,g/m,1 Hr,Valid
Shenyang,PM2.5,3/10/2017 13:00,2017,3,10,13,71,g/m,1 Hr,Valid
Shenyang,PM2.5,3/10/2017 14:00,2017,3,10,14,73,g/m,1 Hr,Valid
